ngiemboon,en
"Saẅi la laʼte nkwaŋá gẅie à gẅiin, légÿo Ndavîd kwé, á mbwó míŋ we Jÿonataŋ mbɔɔ mbwó pʉ̀a pé ntsèm. Táʼ, anò Ndavîd lɔ́ɔn ḿboŋo Jÿonataŋ míŋ Saẅi tɛʼ. ","Saul ordered his son Jonathan and all his servants to kill David.   But Saul’s son Jonathan liked David very much,  # 19:1 1Sm 18:1–3 "
"Jÿonataŋ la gʉa ńkága tuŋó Ndavîd; ńgɔɔn né yé ngie: Tá wɔ̀ɔn Saẅi ne faʼa légÿo, ɔ̀ kwé. Mèŋ sẅíŋte gú ngie ɔ̀ lɔɔn ńgÿo mbaʼámbaʼ jǔɔ, ɔ̀ tyé mboŋó; gÿo ńnáʼa ńtyé pɔ́ jʉʼʉ lelyěen, ńdÿoon mbùm jù. ","so he told him, “My father, Saul, intends to kill you. Be on your guard in the morning and hide in a secret place and stay there. "
"Ńgʉa na mèŋ, mbà peg tá wɔ̀ɔn ge gÿo kẅɛ, n tsege yé nkáʼ gẅie ɔɔ wó lelyěen. N deen ńké ńgɔɔn nò né tá wɔ̀ɔn ńtí gú, é gyá páʼ à ge kẅé púʼu, ńzsé ngie n tǒ shwóŋo gú. ","I’ll go out and stand beside my father in the field where you are and talk to him about you. When I see what he says, I’ll tell you.”  "
"Jÿonataŋ la leen ńké ńkíme Ndavîd mboŋó á mbwó tá we Saẅi, ńgɔɔn ngie: Ankwɔbɔ́, pɔ́ɔn légÿo nò tepòŋ na ngàŋafàʼ gù Ndavîd, mélàʼmie à kaa tsɔ́ nò mbwó gù fʉa. Tà ńcʉ́ʼ púʼu, mbà à ka gÿo pɔ́ nò mbòŋo na gù; ","Jonathan spoke well of David to his father, Saul. He said to him, “The king should not sin against his servant David.   He hasn’t sinned against you; in fact, his actions have been a great advantage to you. "
"À la lɔgɔ twó yé ńdÿɔ́ʼɔ legwé, tà ńzẅé Ngoliyad nyìŋ Filisi. Cʉ̀apʉ̀a laa lyɛʼó ŋwɛ́ ńgÿo epʉ̀a Ésàlayɛ ntsèm pú ńtsẅɛ́. Ɔ̀ la gyá púʼu, ńgẅiin lekág. Tà ɔ̀ ge fʉa nò tà pfɛte metse tefʉ̀a lá? Tà ɔ̀ ge gÿo Ndavîd kwé té gwɔ́ gie à fʉ̌a nò mélàʼakɔ́? ","He took his life in his hands when he struck down the Philistine,   and the Lord brought about a great victory for all Israel.  # 19:5 1Sm 11:13 You saw it and rejoiced, so why would you sin against innocent blood by killing David for no reason? ”  # 19:5 Dt 19:10–13; 1Sm 20:32"
"Saẅi la júʼu nò gie Jÿonataŋ gɔ̌ɔn; ńkʉa ńgɔɔn ngie: N tyě páʼɔɔn á mvfò Cʉ̀apʉ̀a gẅie aa ntʉ̀ntʉ̀, à lɔɔn ngwɔ́ mé le gÿo Ndavîd kwé wɔ́! ","Saul listened to Jonathan’s advice and swore an oath: “As surely as the Lord lives, David will not be killed.” "
"Jÿonataŋ la ńtóŋo Ndavîd, ḿbíte mɛ̌ menò ntsèm mbwó yé; afʉ̀ʼ kuʼ, á lɔgɔ Ndavîd ńgʉa lejʉ́ŋ Saẅi, á leen ńké ńgíŋe ńzye léfaʼa fàʼ yé páʼ à kɔ̌ɔn ńzɔɔn faʼa.","So Jonathan summoned David and told him all these words. Then Jonathan brought David to Saul, and he served him as he did before.  "
"Ncù la pú ne ńkẅiʼi kẅiʼi. Ndavîd kẅɛ ńgʉa ńdÿɔ́ʼ pʉ̀a Filisi; à la pú ńjÿó wɔ́b. Áa mmó gie á la gÿo, pɔ́ fó lejʉ́ŋ yé ńkÿo.","When war broke out again, David went out and fought against the Philistines. He defeated them with such great force that they fled from him."
"Saẅi laa tsɔ́ lyɛ̌ʼ ńnéŋe mbʉ̀a yé, ńkúʼte lekwoŋ sé pwó, Cʉ̀apʉ̀a gÿo atsɔ́ zẅìge tepòŋ gíŋe ńkúu na yé. Ndavîd la ne ḿbúʼu kèkÿɛ̀. ","Now an evil spirit sent from the Lord    came on Saul as he was sitting in his palace holding a spear.  # 19:9 1Sm 18:10 David was playing the lyre,  # 19:9 1Sm 16:14–16; 18:10 "
"Afʉ̀ʼ kuʼ, Saẅi maʼ lekwoŋ sé, éfaʼa lélɔg ńkíme Ndavîd na sagá ndá. Táʼ, Ndavîd lÿɔ́ʼ, é cʉ́ʼ ńkime pɔ́ sagá ndá. Á cʉa púʼu, Ndavîd pú ńkÿo ńgʉa pɔ́ na wɛ̌ letsẅɛ́ʼ. ","and Saul tried to pin David to the wall with the spear.   As the spear struck the wall, David eluded Saul, ran away, and escaped that night. "
"Saẅi túm memántúm á mbʉ̀a Ndavîd, légwɔ́ gie pɔ́ gʉa ḿbyɛ́bɛ yé, à piŋ ńgwɔ́ mbaʼámbaʼ, pɔ́ zẅé yé. Táʼ Mikaa gẅie à laa nzwě Ndavîd, kága tuŋó yé, ńgɔɔn ngie: Ɔ̀ lɔɔn te kÿo ńdyeen letsẅɛ́ʼ lyɛ̌ʼɔɔn wɔ́, mbà á ge gwaa gwɔ́ jǔɔ mbà ɔ̀ kwě. ","Saul sent agents to David’s house to watch for him and kill him in the morning.   But his wife Michal  # 19:11 1Sm 18:20 warned David, “If you don’t escape tonight, you will be dead tomorrow! ” "
"Mikaa la kẅéte Ndavîd, á fó na tɔ̀gɔkyɛʼ ńkẅɛ, ńkÿo, tá ńtsɔgɔ legwé. ","So she lowered David from the window, and he fled and escaped.   "
"Mikaa leen ńké ńkaa tútú, ńtÿɔ́gɔ ndùm kǔ; ńzáb ngùb mêmvfó gie mé la páʼ á na twó kǔ, ńdɔg nzsǒ ḿbwoon. ","Then Michal took the household idol and put it on the bed, placed some goat hair on its head, and covered it with a garment. "
"Saẅi la túm memántúm, tà pɔ́ tó légwóon Ndavîd, Mikaa gɔɔn né pɔ́b ngie: À ne ńguɔ. ","When Saul sent agents to seize David, Michal said, “He’s sick.”  "
"Saẅi gÿo ńgíŋe ńtúmo wɔ́b páʼ pɔ́ ge gʉa líe Ndavîd, ńgɔɔn né pɔ́b ngie: Pi kú ńkaa yé na kǔ ńdɔg ńtó, n zẅé yé.","Saul sent the agents back to see David and said, “Bring him on his bed so I can kill him.” "
"Memántúm la piŋ nzèm, ńgwɔ́ tó, tútú gwɔ́ ndùm kǔ, ngùb mêmvfó gie mé la páʼ gwɔ́ na twó kǔ. ","When the agents arrived, to their surprise, the household idol was on the bed with some goat hair on its head."
"Saẅi gɔɔn né Mikaa ngie: Ɔ̀ fʉte wɔ́ɔn na yɔɔn ntí mélàʼakɔ́? Ɔ̀ gÿǒ lêkɔ́ ńnyé ngàŋmbù wɔ̀ɔn á kÿo? Mikaa tsɔ́ʼɔ mbwó Saẅi ngie: À ka gɔɔn né mèŋ ngie: «Nyé wɔ́ɔn mèŋ n gʉa, tà á té púʼu wɔ́ mbà mèŋ n ge zẅé gú!»","Saul asked Michal, “Why did you deceive me like this? You sent my enemy away, and he has escaped! ”"
"Ndavîd la kÿo páʼɔɔn, ńgʉa ńkẅɛ́te Samîɛ á ngwòŋ Lámà, ḿbú ḿbíte kɔ̀ɔkɔ́ɔ gie Saẅi la gÿo na yé, éshwóŋo yé. Afʉ̀ʼ kuʼ, pɔ́ Samîɛ gʉa, ńtsẅé jʉʼ gie mé tóŋ lê Nayɔd. ",So David fled and escaped and went to Samuel at Ramah   and told him everything Saul had done to him. Then he and Samuel left and stayed at Naioth.  # 19:18 2Kg 6:1–2
"Mé la gʉa shwóŋo Saẅi ngie: Ndavîd aa Nayɔd, á ngwòŋ Lámà. ","When it was reported to Saul that David was at Naioth in Ramah, "
"Saẅi leen ńké ńtúm memántúm ngie pɔ́ gʉa ńgwoon Ndavîd. Pɔ́ kú ńgyá tsɔ́ nùɔ pantsẅìnkʉ̀ Ssé, pɔ́ ne ńtsẅii nkʉ̀ Ssé, tà Samîɛ tyé twómvfò. À Zẅìge Ssé la kúu na memántúm Saẅi, pɔ́ zye yɔ́b létsẅi nkʉ̀ Ssé. ","he sent agents to seize David.   However, when they saw the group of prophets prophesying  # 19:20 1Sm 10:5–6,10 with Samuel leading them, the Spirit of God came on Saul’s agents, and they also started prophesying. "
"Mé gʉa shwóŋo Saẅi, á gíŋe ńtúm petsɔ́ memántúm, tá pɛ̌ gíŋe ńzye yɔ́b létsẅi nkʉ̀ Ssé. Á gíŋe ńtúm petsɔ́ na mbɔ́ɔntè ngʉ̀a ntá, tá pɛ̌ ńgíŋe ńkú, ńzye yɔ́b létsẅi nkʉ̀ Ssé. ","When they reported to Saul, he sent other agents, and they also began prophesying.   So Saul tried again and sent a third group of agents, and even they began prophesying. "
"Á gwɔ́ púʼu, kwàʼ Saẅi lu ssé ńgʉa né Lámà. À la gʉa tà ńkúu jʉʼʉ máamáa gÿǒon ntse gie áa Seku, ńzɛ́te ngie: Samîɛ pɔ́ Ndavîd gwɔ́ pɔ́ nzɔ̌? Mé tsɔ́ʼɔ mbwó yé ngie: Pɔ́ ée Nayɔd, á Lámà. ","Then Saul himself went to Ramah. He came to the large cistern at Secu and asked, “Where are Samuel and David? ”"
"À la gʉa tà ńkúu wó, ńdɔg ye shÿó Nayɔd, á Lámà. À Zẅìge Ssé la kúu na yé ye; á ne ńgiŋe ńtsẅii nkʉ̀ Ssé tà ńkúu Nayɔd, á Lámà. ","So he went to Naioth in Ramah. The Spirit of God also came on him,   and as he walked along, he prophesied until he entered Naioth in Ramah. "
"À la gíŋe ésẅɛ mé menzsǒ, ńzye létsẅi nkʉ̀ Ssé á mvfò Samîɛ; à la gwe ssé, ńnuŋe té maʼ nzsǒ na yɛ̌ lyɛ̌ʼ, tà mbɔɔ na wɛ̌ letsẅɛ́ʼ. Áa mmó gie á la gÿo, epʉ̀a zɛ́te ngie: Saẅi kéen ńcʉ́ʼ yé tsɔ̌ na patsẅìnkʉ̀ Ssé keen?","Saul then removed his clothes and also prophesied before Samuel; he collapsed and lay naked   all that day and all that night. That is why they say, “Is Saul also among the prophets? ”  # 19:20–24 1Sm 10:5–13"
