ngiemboon,en
"Manase la gwaa cʉ́ʼʉ fùɔ, ńgẅiin ngùʼ ntsɔ̀b pʉ́a né legém, ńnéŋe Yelúzálèm, ésáʼa láʼa Yúndà ngùʼ ntsɔ̀b tʉ̂a né móm tʉ̂a. Lezíŋ má we laa lê Esib-Mba. ","Manasseh   was twelve years old when he became king, and he reigned fifty-five years in Jerusalem. His mother’s name was Hephzibah.  # 21:1 Is 62:4 "
"Manase la gÿo mmó gie á té Cʉ̀apʉ̀a poŋ. À la fʉʼʉ pʉ̀a pie Cʉ̀apʉ̀a la fó ngwòŋ ńjwoŋo wɔ́b tá ńnéŋ pʉ̀a Ésàlayɛ, à la tɔ́ɔn mentʉ̀ menò tepòŋ mie pɔ́ lɔ́ɔn ńtɔ́ɔn. ","He did what was evil in the Lord’s sight,   imitating the detestable practices of the nations that the Lord had dispossessed before the Israelites.  # 21:2 2Kg 16:3 "
"À la kwɛ́ mejʉʼ ssé mie tá we Ezekiyásè la pyág, ńnyɛte mejʉʼʉ lenuŋé pwɔʼ ńdɔg ńguʼte ssé Mbâa, ḿbwóon tàʼ ntóon ssé, ndʉŋndʉŋ páʼ Ashÿab fùɔ pa Ésàlayɛ la gÿo tsɔ́ fʉ̀ʼ, ńguʼte mecÿɔ́ʼsaŋ, ḿbiŋ faʼa mbwó pɔ́b. ","He rebuilt the high places that his father Hezekiah had destroyed   and reestablished the altars for Baal. He made an Asherah,  # 21:3 2Kg 23:26 as King Ahab of Israel had done;  # 21:3 1Kg 16:32–33 he also bowed in worship to all the stars in the sky  # 21:3 2Kg 17:16; 23:5 and served them. "
"Ńkwɛ́ mejʉʼʉ lenuŋé pwɔʼ á tsɛ̀ɛ ndá Cʉ̀apʉ̀a, á jʉʼ gie Cʉ̀apʉ̀a la gɔɔn ngie: «Áa jʉʼ gie n ge láʼa gwɔ́ wó.» ","He built altars in the Lord’s temple,   where the Lord had said, “Jerusalem is where I will put my name.”  # 21:4 Dt 12:11,14; 1Kg 11:13 "
"Ńgíŋ ńgʉa tsɛ̀ɛ metetʉ́a mémbʉ́a me ndá Cʉ̀apʉ̀a, ńkwɛ́ mejʉʼʉ lenuŋé pwɔʼ ńdɔg ńguʼte mecÿɔ́ʼsaŋ. ",He built altars to all the stars in the sky   in both courtyards of the Lord’s temple.  # 21:5 1Kg 7:12; 2Kg 23:12 
"À la tuɔ míŋ wé wembaŋa ńdɔg ńnuŋe pwɔʼ, ńtsɔ́ʼ mengɔ̌ɔn ntí ntí, ḿbíge nò mbwó pʉ̀a pie é gÿo mepfó gɔɔn nò, ḿbiŋ ńgwɔ́ pazsé njÿê; mbú ńkẅiʼi ńgÿo pɔ́ mmó gie á té poŋo Cʉ̀apʉ̀a wɔ́, ńdɔg sẅite gyáŋalóŋ yé. ","He sacrificed his son in the fire,  ,# 21:6 Lv 18:21; 2Kg 16:3; 2Ch 28:3 practiced witchcraft and divination, and consulted mediums and spiritists.  # 21:6 Lv 19:26,31; Dt 18:10–12; 2Kg 23:24 He did a huge amount of evil in the Lord’s sight, angering him.  # 21:6 2Kg 23:26"
"Ńkwóon tàʼ tútú ssé Ashÿéla, ńtÿɔ́gɔ tsɛ̀ɛ ndá Ssé. Tá mbà Cʉ̀apʉ̀a la gɔɔn né fùɔ Ndavîd pɔ́ míŋ we fùɔ Salémo ngie: «N ge láʼ gwɔ́ wó, á tsɛ̀ɛ ndá Ssé á Yelúzálèm. N da gʉa na metÿǒsoŋ me mengẅɛ̀te pa Ésàlayɛ, ńtsɔ́ʼ pɔ́ yɔɔn. ","Manasseh set up the carved image of Asherah, which he made, in the temple that the Lord had spoken about to David and his son Solomon: “I will establish my name forever in this temple and in Jerusalem, which I have chosen out of all the tribes of Israel.   "
"Epʉ̀a Ésàlayɛ lɔɔn ńgÿo kwaʼ mmó gie n da tsẅi ngie pɔ́ gÿo, ńgiŋ páʼ membʉ̌ mie Mǒonsê ngàŋafàʼ wɔ̀ɔn la tÿɔ́g ńtíi wɔ́b, mbà n te gíŋ gÿo pɔ́ gwáʼ ngwòŋ wɔ́b gẅie n da náa mbwó pamángʉanjʉʼ pɔ́b ńgwáa ńká wɔ́.» ",I will never again cause the feet of the Israelites to wander from the land I gave to their ancestors if only they will be careful to do all I have commanded them #— #the whole law that my servant Moses commanded them.”   
"Ńgʉa na pʉ̀a Yúndà mbà pɔ́ la te júʼ ncwò Cʉ̀apʉ̀a wɔ́, Manase la tsóte wɔ́b, pɔ́ kẅiʼi ńtɔ́ɔn menò tepòŋ tà é cʉa me pʉ̀a pie Cʉ̀apʉ̀a la pyága wɔ́b tá ńnáa jʉʼ né pɔ́b.",But they did not listen; Manasseh caused them to stray so that they did worse evil than the nations the Lord had destroyed before the Israelites.  
"Áa mmó gie á la gÿo, Cʉ̀apʉ̀a tsẅi né megàŋafàʼ pé pie ée pantsẅìnkʉ̀ Ssé ngie: ","The Lord said through his servants the prophets, "
"«Afùɔ Manase tɔ̌ɔn mɔɔn mentʉ̀ menò tepòŋ. À tɔ̌ɔn tà é cʉa mie pʉ̀a Amɔɔ la tɔ́ɔn tsɔ́ fʉ̀ʼ. À ka lɔg messé tepòŋ mé ńtsóte pʉ̀a Yúndà, pɔ́ fʉa nò. ","“Since King Manasseh of Judah has committed all these detestable acts    #— #worse evil than the Amorites  # 21:11 Gn 15:16; 1Kg 21:16 who preceded him had done #— #and by means of his idols has also caused Judah to sin, "
"Cʉ̀apʉ̀a, é Ssé pa Ésàlayɛ ne ńgɔɔn ngie: “N ge gÿo máamáa ngɔ́ʼ kú pʉ̀a Yelúzálèm, pâ pʉ̀a Yúndà, tà wɔ̌ nyìŋ wɔ́ɔ à júʼ, ńcÿɔʼ. ","this is what the Lord God of Israel says: ‘I am about to bring such a disaster on Jerusalem and Judah that everyone who hears about it will shudder.  ,# 21:12 1Sm 3:11; Jr 19:3 "
"N ge pyága tÿǒsoŋo Yelúzálèm, páʼ n da pyága tÿǒsoŋo Samalîɛ, mbɔɔ tsìŋendá Ashÿab. N ge pú jÿɔgɔ tÿǒsoŋo Yelúzálèm, é jÿɔg patsẅé wó páʼ mé sɔgɔ pelékáŋ tà sele nzèm la. ","I will stretch over Jerusalem the measuring line used on Samaria and the mason’s level used on the house of Ahab,   and I will wipe  # 21:13 2Kg 23:27 Jerusalem clean as one wipes a bowl #— #wiping it and turning it upside down. "
N ge gÿo gwáʼ pʉ̀a pɔ́ɔn pie é ge gÿo tsɔgɔ. N ge gÿo sẅéen wɔ́b ńnáa né megàŋmbù pɔ́b; pɔ́ pú ńtúʼ shúm sɔ́b. ,"I will abandon the remnant   of my inheritance and hand them over to their enemies. They will become plunder and spoil to all their enemies, "
"N ge gÿo gÿo púʼu, mélàʼmie pʉ̀a pɔ́ɔn ée ńké ńgÿo pɔ́ mmó gie á te wɔ́ɔn poŋ. Tà fó páʼ pamángʉanjʉʼ pɔ́b la fó ngwòŋ Egíbtò ńkẅɛ ńgʉa ńkú lyɛ̌ʼɔɔn, pɔ́ ée ńké ńtsẅé sẅite gyáŋalóŋ yɔ́ɔn sẅite.”»",because they have done what is evil in my sight and have angered me from the day their ancestors came out of Egypt until today.’ ”  
"Afùɔ Manase la pú ńzẅéte membǔʼ, tà tÿǒsoŋo Yelúzálèm ntsèm cʉ́ʼ ńgwɔ́ pɔ́ metse metse. Ayɔɔn nò áa páʼɔɔn ńkẅiʼi na mefʉa gẅie à la tsóte pʉ̀a Yúndà pɔ́ fʉa. Á la tsóte wɔ́b pɔ́ gÿo mmó gie á té poŋo Cʉ̀apʉ̀a wɔ́. ","Manasseh also shed so much innocent blood that he filled Jerusalem with it from one end to another.   This was in addition to his sin that he caused Judah to commit, so that they did what was evil in the Lord’s sight."
"Apfwɔ̀ʼɔ píte menò Manase, áa ye ŋweʼe tsɛ̀ɛ ŋwàʼne píte menò mefùɔ pà Yúndà; esɔɔn lepuʼú ŋwàʼne pú ḿbíte kɔ̀ɔkɔ́ɔ gie à la gÿo, mbɔɔ mefʉa we ntsèm. ","The rest   of the events of Manasseh’s reign, along with all his accomplishments and the sin that he committed, are written in the Historical Record of Judah’s Kings.  # 21:17 2Kg 20:20 "
"Manase la kwé, mé túŋo yé tsɛ̀ɛ nkáʼa nzab mentí mentí gẅie ée nɔʼ yé, á jʉʼ gie mé gíŋ ńtóŋ lê «nkáʼa nzab mentí mentí we Uza.» Míŋ we Amoŋ jÿó ndá yé, ńcʉ́ʼʉ fùɔ.","Manasseh rested with his ancestors and was buried in the garden of his own house, the garden of Uzza. His son Amon became king in his place."
"Amoŋ la gwaa cʉ́ʼʉ fùɔ, ńgẅiin ngùʼ ntsɔ̀b pʉ́a né móm mbʉ́a, ńnéŋe Yelúzálèm, ésáʼa láʼa Yúndà ngùʼ pʉ́a. Lezíŋ má we gwɔ́ lê Meshulemed, á gwɔ́ míŋ Alúsè gẅie à laa nyìŋ tÿǒsoŋo Yotemba. ","Amon was twenty-two years old when he became king,   and he reigned two years in Jerusalem. His mother’s name was Meshullemeth daughter of Haruz; she was from Jotbah. "
"Amoŋ la gÿo mmó gie á té Cʉ̀apʉ̀a poŋ, pɔ́ páʼ tá we Manase. ","He did what was evil in the Lord’s sight, just as his father Manasseh had done.   "
"À la gÿo kwaʼ páʼ tá we. À la faʼa mbwó tsɔ́ messé, é messé mie tá we lɔ̌ɔn faʼa mbwó pɔ́b, ḿbiŋe ńŋwɔ́ʼɔ nnɛ́ mvfò pɔ́b. ","He walked in all the ways his father had walked; he served the idols his father had served, and he bowed in worship to them.   "
"Ńgwáʼa Cʉ̀apʉ̀a, é Ssé metá pé, ḿbíŋ te gÿo mmó gie Cʉ̀apʉ̀a tsẅǐ né yé wɔ́. ",He abandoned the Lord God of his ancestors   and did not walk in the ways of the Lord.  # 21:22 2Kg 22:17
"Meŋwǎláʼ Amoŋ lɔ́ɔn ncù wé, ńzẅé yé tsɛ̀ɛ nɔʼ yé. ",Amon’s servants conspired against him and put the king to death in his own house.   
"Táʼ, epʉ̀a láʼa Yúndà pú ńzẅéte pʉ̀a pie é lɔ̌ɔn ncù fùɔ Amoŋ, ńtsɔ́ʼɔ míŋ we Jÿosiyásè, á jÿó ndá yé, ńcʉ́ʼʉ fùɔ.","The common people   killed  # 21:24 2Kg 14:5 all who had conspired against King Amon, and they made his son Josiah  # 21:24 2Kg 22:1 king in his place."
"Apfwɔ̀ʼɔ píte menò Amoŋ, á nò na mmó ntsèm gie à la gÿo, áa ye ŋweʼe tsɛ̀ɛ lepuʼú ŋwàʼne píte mefùɔ pà Yúndà. ","The rest of the events of Amon’s reign, along with his accomplishments, are written in the Historical Record of Judah’s Kings. "
"Mé la túŋo Amoŋ tsɛ̀ɛ sé lesyè, á tsɛ̀ɛ nkáʼa nzab mentí mentí we Uza, míŋ we Jÿosiyásè jÿó ndá ye, ńcʉ́ʼʉ fùɔ.","He was buried in his tomb in the garden of Uzza, and his son Josiah became king in his place."
