ngiemboon,en
"Mɔɔn menò la tɔ́g, Ndavîd zɛ́te Cʉ̀apʉ̀a ngie: «Ngwɔ́ n gʉa né tsɛ̀ɛ tsɔ́ tÿǒsoŋ Yúndà?» Cʉ̀apʉ̀a tsɔ́ʼɔ mbwó yé ngie: «Oon, ngwɔ́ ɔ̀ gʉa.» Ndavîd gíŋ ńzɛ́te ngie: «N ge gʉa né tsɛ̀ɛ yɛ̌?» Á tsɔ́ʼ ngie: «Ɔ̀ ge gʉa né Embeloŋ.» ","Some time later, David inquired of the Lord:   “Should I go to one of the towns of Judah? ”"
"Ndavîd pâ mezwě pé mépʉ́a la pú ḿbʉ né Embeloŋ, wɔɔn laa nzwě we Ayinowam gẅie à laa múɔ Jʉzeleyɛɛ, ńgÿo Ambigayɛɛ gẅie à laa mpfɔ̌g Nambaa nyìŋ Kamɛɛ. ","So David went there with his two wives, Ahinoam the Jezreelite and Abigail, the widow of Nabal the Carmelite.   "
"Ndavîd la gwaa gʉa púʼu, ńdɔg mbàŋa gie pâ pɔ̌ lɔ́ɔn ńtsẅé, lâ pʉ̀a metsìŋendá mɔ́b ńgʉa. Pɔ́ la gʉa ńkú ńtsẅé mengʉ̀ŋe metÿǒsoŋ mie ée shÿó Embeloŋ. ","In addition, David brought the men who were with him, each one with his family, and they settled in the towns near Hebron.   "
"Epʉ̀a Yúndà la gʉa tà ńkúu jʉʼó, ńdɔg mevɛ́ ńcÿɔʼɔ Ndavîd. Ńdeen ńké ńdɔgɔ yé ńgÿo fùɔ na ngẅɛ̀te Yúndà.","Then the men of Judah came, and there they anointed David king over the house of Judah.   They told David, “It was the men of Jabesh-gilead who buried Saul.”  # 2:4 1Sm 31:11–13"
"Ndavîd túm memántúm ngie pɔ́ gʉa ńgɔɔn né pʉ̀a Yambɛ́shÿè pie ée shÿó Ngalad ngie: «Cʉ̀apʉ̀a cʉate na pyennɛ́ gie pi ka gẅiin nzèm ndè gẅi, ńnéŋ mbʉ́lè na pi, ńtí nue pi zɔ ka túŋo yé. ","David sent messengers to the men of Jabesh-gilead and said to them, “The Lord bless you because you have shown this kindness to Saul your lord when you buried him. "
"Afʉ̀ʼɔɔn la, á ne ńzɛ́te ngie Cʉ̀apʉ̀a nyɛɛ gẅi pyennɛ́ yé pɔ́ pòŋontʉ́m yé! Kwàʼ mèŋ yɔ́ɔn, n ge gíŋ gÿo yɔ́ɔn nò mbòŋo na pi mélàʼmie pi ka gÿo nò mbòŋo na mèŋ. ","Now, may the Lord show kindness and faithfulness to you, and I will also show the same goodness to you because you have done this deed. "
"Pi gẅiin shÿɔ̀g, ḿbiŋ ńtʉte: afùɔ gẅi Saẅi ka kwě, epʉ̀a na ngẅɛ̀te Yúndà pǐŋ ńzɔ́ʼɔ wɔ́ɔn páʼ n ge gwɔ́ fùɔ wɔb.»","Therefore, be strong   and valiant, for though Saul your lord is dead, the house of Judah has anointed me king over them.”"
"Á gwaa gwɔ́ púʼu, mbà Abnɛɛ míŋ Nɛ̂ɛ gẅie à laa tándá ncù we Saẅi ka lɔgɔ Eshÿe-Mboshÿɛd gẅie à laa míŋ Saẅi ńgʉa né Mahanayîm. ","Abner son of Ner, commander of Saul’s army,   took Saul’s son Ish-bosheth  # 2:8 Some LXX mss read Ishbaal; 1Ch 8:33; 9:39,# 2:8 = Man of Shame and moved him to Mahanaim. "
"Abnɛɛ la kúu wó, ńzɔ́ʼɔ Eshÿe-Mboshÿɛd ńdɔg ńgÿo fùɔ gẅie à ge sáʼ ngwòŋ Ngalad, é sáʼ ngwòŋ Ashûu, é sáʼ ngwòŋ Jʉzeleyɛɛ, é sáʼ ngwòŋ Efalayîm, é sáʼ ngwòŋ Mbɛŋjÿamɛŋ, à la pú sáʼ ngwòŋ Ésàlayɛ ntsèm. ","He made him king over Gilead, Asher, Jezreel, Ephraim, Benjamin #— #over all Israel. "
"Eshÿe-Mboshÿɛd gẅie à laa míŋ Saẅi la gwaa cʉ́ʼʉ fùɔ pa Ésàlayɛ, ńgẅiin ngùʼ móm lekùɔ. À la sáʼ ngwòŋ Ésàlayɛ ngùʼ pʉ́a. Epʉ̀a na ngẅɛ̀te Yúndà ndàʼ zɔ̌ lɔ́ɔn ńzsé ngie Ndavîd aa fùɔ. ","Saul’s son Ish-bosheth was forty years old when he became king over Israel; he reigned for two years. The house of Judah, however, followed David. "
"Ndavîd la néŋe Embeloŋ, ésáʼ pʉ̀a Yúndà na ngùʼ sɔɔnmbʉ́a né mesaŋ ntɔgɔ́.",The length of time that David was king in Hebron over the house of Judah was seven years and six months.  
"Abnɛɛ míŋ Nɛ̂ɛ, mbɔɔ palÿɔ́ʼncù pe Eshÿe-Mboshÿɛd pie é laa penkʉ́ Saẅi la fó Mahanayîm, ńgʉa né Ngambahoŋ. ",Abner son of Ner and soldiers of Ish-bosheth son of Saul marched out from Mahanaim to Gibeon. 
"Jÿohab míŋ Tseluya pâ palÿɔ́ʼncù pe fùɔ Ndavîd lu yɔ́b ssé, ńcʉ́me mánzsè. Menùɔ ŋwɛ́ mémbʉ́a pú ḿbumte á ngʉ̀ŋe gÿǒon ntse Ngambahoŋ. Yɛ̌ yɛ̌ nùɔ wɔ́ɔ tyé na wé nkwɔʼɔ́. ",So Joab son of Zeruiah and David’s soldiers marched out and met them by the pool of Gibeon.   The two groups took up positions on opposite sides of the pool.
Abnɛɛ gɔɔn né Jÿohab ngie: «N gyǎ yɔ́ɔn ngie ngwɔ́ mé gÿo ngwàshùm yégè lu ssé ńdÿɔ́ʼɔ mvfò pege.» Jÿohab tsɔ́ʼ ngie: «Áa kwaʼ púʼu!» ,"Then Abner said to Joab, “Let’s have the young men get up and compete in front of us.”"
"Palÿɔ́ʼncù ntsɔ̀b pʉ́a la kẅɛ́ɛ na ngẅɛ̀te Mbɛŋjÿamɛŋ, ńgwɔ́ pʉ̀a pie é fóo na nùɔ palÿɔ́ʼncù pe fùɔ Eshÿe-Mboshÿɛd gẅie aa míŋ Saẅi; petsɔ́ ntsɔ̀b pʉ́a kẅɛɛ na nùɔ palÿɔ́ʼncù pe fùɔ Ndavîd. ","So they got up and were counted off #— #twelve for Benjamin and Ish-bosheth son of Saul, and twelve from David’s soldiers. "
"Awɛ̌ ndÿɔ̀ʼncù wɔ́ɔ la gwoon ngàŋmbù we pɔ́ na twó yé, ńdɔg nně ncù, ésɔbɔ gwoŋó nnɛ́ yé, pɔ́ yé pú ńgwe. Mé leen ńké ńtsẅi lezíŋ yɛ̌ jʉʼ gie áa Ngambahoŋ lê «nkáʼa metǒon».","Then each man grabbed his opponent by the head and thrust his sword into his opponent’s side so that they all died together. So this place, which is in Gibeon, is named Field of Blades.  "
"Á laa na yɛ̌ lyɛʼɛ́ láʼ ŋwɛ́, ncù pú ńgáʼ tɛʼ. Palÿɔ́ʼncù pe fùɔ Ndavîd la jÿó Abnɛɛ pâ pʉ̀a Ésàlayɛ. ","The battle that day was extremely fierce, and Abner and the men of Israel were defeated by David’s soldiers. "
"Penkʉ́ Tseluya métá laa yɔ́b legẅì ncù, mezíŋ penkʉ́ ŋwɛ́ emɔɔn: wɔɔn laa Jÿohab, wɔɔn gwɔ́ Ambishÿayi, ńgÿo Asayɛɛ. Asayɛɛ ŋwɛ́ laa nyìŋ ḿvele, ḿbiŋ ńkÿo páʼ tsẅénɔ̀ɔn la. ","The three sons of Zeruiah were there: Joab, Abishai, and Asahel.   Asahel was a fast runner, like one of the wild gazelles.  # 2:18 1Ch 12:8; Sg 8:14 "
"Asayɛɛ la cʉ́me nzèm Abnɛɛ, ńnɔ́ɔn yé pɔ́ té tʉ́ŋe ńdɔg ye gwoŋó pwó tʉ̀ kà ye kyɛ̀bɛ wɔ́ɔ. ",He chased Abner and did not turn to the right or the left in his pursuit of him. 
"Abnɛɛ sele nnɛ́ ńzɛ́te yé ngie: «Gù zɔɔ Asayɛɛ?» Á tsɔ́ʼ ngie: «Oon, aa kwàʼ wɔ́ɔn.» ","Abner glanced back and said, “Is that you, Asahel? ”"
"Abnɛɛ gɔɔn né yé ngie: «Nyé wɔ́ɔn, ńnɔ́ɔn tsɔ̌ nyìŋ ndyɛ̀ʼɛ, lɔg ye gwoŋó pwó tʉ̀ kà yekyɛ̀bɛ wɔ́ɔ, ńgwoon tsɔ̌ tàʼ na púɔshùm pɛ̂ pie ée palÿɔ́ʼncù, ńkẅé shúm ncù sé.» Táʼ, Asayɛɛ ké ńgwɔ́ nzèm yé ńjwoŋo yé jwoŋ. ","Abner said to him, “Turn to your right or left, seize one of the young soldiers, and take whatever you can get from him.” But Asahel would not stop chasing him. "
"Abnɛɛ gíŋe ńgɔɔn né Asayɛɛ ngie: «Te gíŋe ńjwoŋo wɔ́ɔn; ɔ̀ faʼa légÿo n zẅé gú mélàʼakɔ́? N dɔɔn ńzẅé gú, mbà n ge gíŋe líe fɛ̌ gù Jÿohab lêkɔ́?» ","Once again, Abner warned Asahel, “Stop chasing me. Why should I strike you to the ground? How could I ever look your brother Joab in the face? ”  "
"Táʼ, Asayɛɛ lʉʼʉ léfó nzèm yé ésẅɛʼte nnɛ́. Abnɛɛ leen ńké ńdɔg lekwoŋ ésɔbɔ yé lepfòm yé, tà lekwoŋ kẅɛɛ nkàʼ yé. Asayɛɛ gwe jʉʼó ńkwé. Epʉ̀a metsèm pie é lɔɔn ńcʉa jʉʼ gie Asayɛɛ la kwé wó, é lɔɔn těen ńnyé té tyé wɔ́.","But Asahel refused to turn away, so Abner hit him in the stomach with the butt of his spear. The spear went through his body, and he fell and died right there. As they all came to the place where Asahel had fallen and died, they stopped,   "
"Táʼ, Jÿohab pɔ́ Ambishÿayi la cʉ́me nzèm Abnɛɛ, ńnɔ́ɔn yé. Pɔ́ la nɔ́ɔn yé nɔ̌ɔn tà ńgwaa kúu Ngimbeya-Amaa á gwɔ́ ncwònzém. Ngimbeya-Amaa ŋwɛ́ aa shÿó sǎʼnèm Ngiya, á na mánzsè kwòŋotsẅɛ Ngambahoŋ. ","but Joab and Abishai pursued Abner. By sunset, they had gone as far as the hill of Ammah, which is opposite Giah on the way to the wilderness of Gibeon."
"Palÿɔ́ʼncù pie é kẅɛɛ na ngẅɛ̀te Mbɛŋjÿamɛŋ la cúʼte ńtyé nzèm Abnɛɛ. Pâ pɔ̌ kwɔ́ʼ, ńtyé ndùm tsɔ́ lekwɔʼɔ́. ",The Benjaminites rallied to Abner; they formed a unit and took their stand on top of a hill. 
Abnɛɛ tóŋo Jÿohab ńzɛ́te yé ngie: Pege ge kẅiʼi é zẅéte mennɛ́ mégè zẅeté ne menně ncù la? Ɔ̀ te ne ńgyá ngie yɔɔn nò ge gÿo mag té poŋ tɛʼ wɔ́ ka? Ɔ̀ zẅíʼte kɔ́ tá gɔɔn né pʉ̀a pú ngie tà pɔ́ gíŋ ńnɔ́ɔn mefɛ̌ pɔ́b? ,"Then Abner called out to Joab, “Must the sword devour forever? Don’t you realize this will only end in bitterness? How long before you tell the troops to stop pursuing their brothers? ”"
"Jÿohab tsɔ́ʼ ngie: Á na lezíŋ Cʉ̀apʉ̀a, ɔ̀ gwéʼe te nò gɔɔn, mbà pʉ̀a pɔ́ɔn ké ńnɔ́ɔn mefɛ̌ pɔ́b nɔ̌ɔn tà ńkú mbaʼámbaʼ jǔɔ. E shwóŋo gú páʼɔɔn kwàʼ nò nénʉ́.","“As God lives,” Joab replied, “if you had not spoken up, the troops wouldn’t have stopped pursuing their brothers until morning.”   "
"Jÿohab la leen ńké ńtóŋ ntaŋ. Palÿɔ́ʼncù pé tyé, pɔ́ té gíŋ ńnɔ́ɔn palÿɔ́ʼncù pe Ésàlayɛ wɔ́, ncù záʼa. ","Then Joab blew the ram’s horn, and all the troops stopped; they no longer pursued Israel or continued to fight. "
"Abnɛɛ pâ pʉ̀a pé la láʼa na wɛ̌ letsẅɛ́ʼ, ńgiŋe tsɛ̀ɛ fúʼu Juundʉŋ. Éfó wó ńtúm ntse, ḿbú ńzyɛ́ʼɛ pàga láʼa Mbiteloŋ ńdeen ńké ńkúu Mahanayîm. ","So Abner and his men marched through the Arabah all that night. They crossed the Jordan, marched all morning,   and arrived at Mahanaim.  # 2:29 2Sm 2:8"
"Jÿohab la tsẅé jʉʼ légíŋ ńnɔ́ɔn Abnɛɛ púʼu, ńcúʼte pe palÿɔ́ʼncù, ńgyá palÿɔ́ʼncù pe Ndavîd ne ńzága pʉ̀a ntsɔ̀b lepfwɔʼɔ́ né legém, tá ńgÿo Asayɛɛ. ","When Joab had turned back from pursuing Abner, he gathered all the troops. In addition to Asahel, nineteen of David’s soldiers were missing, "
"Ḿbiŋ ńgʉa na palÿɔ́ʼncù pe Mbɛŋjÿamɛŋ pɔ́ ye Abnɛɛ, mbà palÿɔ́ʼncù pe fùɔ Ndavîd la zẅéte wɔ́b, tà pɔ́ gwɔ́ pʉ̀a móm ntɔgɔ́ nzèm nkÿo tá. ",but they had killed 360 of the Benjaminites and Abner’s men. 
"Pɔ́ la kaa pfó Asayɛɛ, ńdɔg ńgʉa ńtúŋo tsɛ̀ɛ lesyè tá we á Mbɛ́tèlehɛm. Jÿohab pâ pʉ̀a pé la láʼa láʼ ńgiŋ giŋ tà á gwaa gwɔ́ nkwɔ̀ʼnjÿó, pɔ́ kúu Embeloŋ.","Afterward, they carried Asahel to his father’s tomb in Bethlehem and buried him. Then Joab and his men marched all night and reached Hebron at dawn."
