ngiemboon,en
"Pɔ̂ɔ pɔ́ Silásè lu ssé ńcʉa ye tÿǒsoŋ Amefipoli mbɔɔ ye Apoloni, ńgʉa tà ńkúu tÿǒsoŋ Tesaloníkà, ńgyá tàʼ ndá cúʼtè pà Yúndà gwɔ́ wó. ","After they passed through Amphipolis and Apollonia, they came to Thessalonica,   where there was a Jewish synagogue. "
"Pɔ̂ɔ kúu tsɛ̀ɛ yɛ̌ ndá cúʼtè légyá pà Yúndà, á gwɔ́ mà mbwó yé, ńgʉa wó gʉa té tsó na lyɛ̌ʼ nzse pà Yúndà sétá. Pâ pà Yúndà ne ńtóŋo Ŋwàʼne Ssé, ńtúu nò ńnáa mǒ. ","As usual, Paul went into the synagogue, and on three Sabbath days reasoned with them from the Scriptures,   "
"Pɔ̂ɔ ne ńnyɛte ńkyagte shwóŋo wɔ́b ngie Nzàʼnkÿo gẅie mé ka ne ḿbyɛ́bɛ la, ka gẅiin légyá ngɔ́ʼ, ńkwé, ḿbiŋ ńzíme na legwé. A Nzàʼnkÿo awɛ̌ aa Yěsô gẅie yé shwóŋo wɔ́b lɔɔn. ",explaining and proving that it was necessary for the Messiah to suffer and rise from the dead: “This Jesus I am proclaiming to you is the Messiah.”   
"Etsɔ́ ntáʼ pà Yúndà júʼ, á kúte wɔ́b, pɔ́ zẅíŋ, ńcʉ́me nzèm Pɔ̂ɔ pɔ́ Silásè, tà mbɔɔ tsɔ́ pà Ngelékiya tà ńgyɔ́ɔn pie é la zẅíŋe nò Ssé pà Ésàlayɛ. Tà mbɔɔ tsɔ́ panzwě pie ée tÿǒsoŋ, ńcʉ́e, é zẅíŋ yɔ́b.","Some of them were persuaded and joined Paul and Silas, including a large number of God-fearing Greeks, as well as a number of the leading women.  "
"Tá pà Yúndà pie é lʉ̌ʼ, gyá púʼu, ńkwɔ́ʼɔ lóŋ, ńgʉa metwó nzsè, ńcúʼte patekǔ na nò, pâ pɔ̌ sẅite láʼ, ḿmaʼa vàʼ tÿǒsoŋ. Pɔ́ gʉa ndá Yasoŋ léfaʼa Pɔ̂ɔ pɔ́ Silásè páʼ pɔ́ ge gwoon wɔ́b gʉa tÿɔ́gɔ wɔ́b mvfò láʼ, ","But the Jews became jealous, and they brought together some wicked men from the marketplace, formed a mob, and started a riot in the city. Attacking Jason’s house, they searched for them to bring them out to the public assembly.   "
"ńkúu wó, pɔ́ té wɔ́b gyá; éfó ńgwoon Yasoŋ pâ tsɔ́ mefɛ̌ mefɛ̌, ńdɔgɔ wɔ́b ńgʉa tà ńkúu mvfò pasáʼntsaŋ, pà Yúndà lɔg ngyè tetʉ̂ ńgɔɔn ngie: «Epʉ̀a pɔɔn pǔ ḿmaʼa vàʼ jʉʼ ntsèm. Agie pɔ́ lɔ̌g ńtó tà ńkúu jʉʼɔɔn lɔɔn! ","When they did not find them, they dragged Jason and some of the brothers before the city officials, shouting, “These men who have turned the world upside down have come here too, "
"Yasoŋ kéen ńkúe wɔ́b mbʉ̀a yé. Pɔ́ ne ńgwá ńgwága lepʉ̌ Kásà, ńgɔɔn ngie atsɔ̌ fùɔ aa wó, mé tóŋo yé lê Yěsô.» ","and Jason has welcomed them. They are all acting contrary to Caesar’s decrees,   saying that there is another king #— #Jesus.”  # 17:7 Lk 23:2; Jn 19:12 "
Yɔɔn shwóŋè pú ńcuʼu twó láʼ tà mbɔɔ ye patsɔ́ʼte mentsaŋ tÿǒsoŋ. ,The crowd and city officials who heard these things were upset. 
Á gwɔ́ gwɔ̌ tà pasáʼa láʼ zɛ́te mbwó Yasoŋ pâ petsɔ́ mefɛ̌ mefɛ̌ ngie pɔ́ nuŋe mbwɔ̀ʼ nkáb ssé tá mé nyé wɔ́b.,"After taking a security bond from Jason and the others, they released them."
"Nzěm leen ńgwaa síŋ, mefɛ̌ mefɛ̌ ńgÿo Pɔ̂ɔ pɔ́ Silásè gʉa né tÿǒsoŋ Mbelɛ, ńgʉa tà ńkúu wó, ńgʉa ndá cúʼtè pà Yúndà. ","As soon as it was night, the brothers and sisters sent Paul and Silas away to Berea.   Upon arrival, they went into the synagogue of the Jews. "
"Pa Yúndà pie ée na yɛ̌ tÿǒsoŋ gẅiin ntʉ́m mbòŋo, ńcʉa pie ée Tesaloníkà. Pɔ́ zẅíʼte shwóŋè Pɔ̂ɔ pɔ́ Silásè lé ntʉ́m mbòŋo, ńgwɔ́ lyɛ̌ʼ ntsèm, ńne ńtóŋo Ŋwàʼne Ssé, ńtuu nò ńnáa mǒ, éfaʼa lézsé ka nò gie pɔ́ shwóŋo wɔ́b, áa púʼu wɔ́. ","The people here were of more noble character than those in Thessalonica, since they received the word with eagerness and examined   the Scriptures  # 17:11 Is 34:16; Lk 16:29; Jn 5:39 daily to see if these things were so. "
"Pʉ̀a tà ńgyɔ́ɔn tsetsɛ̀ɛ pɔ́b fó púʼu, ńzáb ntʉ́m wɔ́b na Yěsô. Tà mbɔɔ panzwě pà Ngelékiya pie é cʉ́e, mbɔɔ mbàŋa tà ńgyɔ́ɔn gíŋe ńzáb yɔ́b. ","Consequently, many of them believed, including a number of the prominent Greek women as well as men. "
"Tá pà Yúndà pe Tesaloníkà júʼ páʼ Pɔ̂ɔ áa Mbelɛ, ńgíŋe ne shwóŋo nò Ssé, ńjwoŋte ńtóo wó, ńzye lémaʼa vàʼ, ńdɔg sẅite láʼ. ","But when the Jews from Thessalonica found out that the word of God had been proclaimed by Paul at Berea, they came there too, agitating and upsetting   the crowds. "
Mefɛ̌ mefɛ̌ gwóon ńgÿo Pɔ̂ɔ lɔg shÿó ntse tépàa ńgʉa. Silásè pɔ́ Timotê cʉ́ʼ ńzso Mbelɛ. ,"Then the brothers and sisters immediately sent Paul away to go to the coast, but Silas and Timothy   stayed on there. "
"Epʉ̀a pie é la gʉa ńtsege Pɔ̂ɔ lɔgɔ yé ńgʉa tà ńkúu Atɛ̀ne, ńgwaa piŋ nzèm, Pɔ̂ɔ tsẅi né pɔ́b ngie pɔ́ gÿo Silásè pɔ́ Timotê lwo ńtó ńkẅɛ́te yé.","Those who escorted Paul brought him as far as Athens, and after receiving instructions for Silas and Timothy to come to him as quickly as possible, they departed.  "
"Pɔ̂ɔ gwaa ne zẅíʼte wɔ́b á Atɛ̀ne, ńgyá shúm ntí ntí sie pʉ̀a tÿǒsoŋ ayɛ̌ guʼte, ńdɔgɔ ńgÿo Ssé, é gyɔ́ɔn páʼɔɔn tɛʼ, mbùm ye pú ńtsyɛte. ","While Paul was waiting for them in Athens, he was deeply distressed when he saw that the city was full of idols. "
"Á ne ńgee ndá cúʼtè pà Yúndà, ńkẅɛ́te pà Yúndà mbɔɔ pazẅíŋe nò Ssé pà Yúndà ńne shwóŋo wɔ́b nò, ńgwɔ́ lyɛ̌ʼ ntsèm, ńgee ndùmo gyɛ̌, ńgyá pʉ̀a pie ée wó, ńgíŋe shwóŋo wɔ́b nò. ","So he reasoned in the synagogue with the Jews and with those who worshiped God, as well as in the marketplace every day with those who happened to be there.   "
"Pâ tsɔ́ pakwaŋte nò, mé tóŋ tsɔ́ lê nùɔ Setoyisyeen, ńtóŋ petsɔ́ lê nùɔ Epikẅii gíŋe ne shwóŋe. Á laa púʼu, Pɔ̂ɔ ne ńgɔɔn nò Yěsô mbwó pɔ́b, mbɔɔ nò ná lezimé na legwé. Petsɔ́ ne ńzɛ́te ngie: «Wɛ̂ ngàŋa shwǒŋ gɔɔn ngie kɔ́ lɛ?» Petsɔ́ ne ngie: «Á gwáʼa fʉ̀ʼe à shwóŋo wégè nò na tsɔ́ messé mendyɛ̀ʼɛ la.» ","Some of the Epicurean and Stoic philosophers also debated with him. Some said, “What is this ignorant show-off   trying to say? ”"
"Pɔ́ lɔgɔ Pɔ̂ɔ ńgʉa mvfò Aleyopaajÿe, á gwɔ́ cúʼtè pasáʼntsaŋ tÿǒsoŋ, ńkúu wó, ńzɛ́te yé ngie: «À lɔɔn ngwɔ́ peg zsé yég nò sẅé yɛ̂ gie ɔ̀ zíʼi pʉ̀a lɛ̂? ","They took him and brought him to the Areopagus,   and said, “May we learn about this new teaching you are presenting?  # 17:19 Mk 1:27; Ac 17:22 "
Menò mie ɔ̀ gwaa shwóŋo wég ne ńkʉʼʉ wég kʉʼʉ. Peg ne ńkwoŋo lécwoŋo ńzsé páʼ ɔ̀ lɔgɔ ńgɔɔn.» ,"Because what you say sounds strange to us, and we want to know what these things mean.” "
"Á la gwaa gwɔ́ púʼu, ńtí nue pʉ̀a pie ée tÿǒsoŋ Atɛ̀ne mbɔɔ pʉ̀a pie é fóo túm, ńtóo ńtsẅé wó, lɔ́ɔn ńgwɔ́ fʉ̀ʼ ntsèm, ńcúʼte ḿbíte kà ńjúʼu pɔ́ menò mesẅé mie é nyé tá ńkẅɛɛ wɔ́ɔ.",Now all the Athenians and the foreigners residing there spent their time on nothing else but telling or hearing something new.
"Pɔ̂ɔ leen ńké ńdu ssé ńtyé tsetsɛ̀ɛ cúʼtè pasáʼa tÿǒsoŋ ńgɔɔn ngie: «Epʉ̀a Aleyopaajÿe, n gyǎ pi tyé na kɔ̀ɔkɔ́ɔ wɔ́ɔ, ńgwɔ́ pʉ̀a, ńnéŋe twó na nò messé mí tɛʼ. ","Paul stood in the middle of the Areopagus and said, “People of Athens! I see that you are extremely religious in every respect. "
"N gwǎ ńgiŋe tsɛ̀ɛ tÿǒsoŋ gí, ńgyá mendá messé mí gyǎ, tà ńgyá tsɔ̌ gwɔ́ wó, mbà mé la ŋweʼe mǒ ngie: “Yɔɔn áa jʉʼʉ ssé gie peg kaa lezíŋ sé zsé.” Áa yɛ̌ tá, yɛ̌ Ssé gie pi tsẅé ńguʼte yé té zsé yé la, n tóo páʼɔɔn léshwóŋo gẅí nò yé. ","For as I was passing through and observing the objects of your worship, I even found an altar on which was inscribed, ‘To an Unknown God.’ Therefore, what you worship in ignorance, this I proclaim to you. "
E Ssé gie e la nyɛte njÿó laa shúm sie é pú ńgwɔ́ wó. Yé zɔɔ Cʉ̀apʉ̀a tÿǒ lepwó mbɔɔ ndùmo ssé tsetsáʼ. Aa těen ńtsẅé tsɛ̀ɛ mejʉʼʉ ssé mie pʉ̀a mesoŋ lɔ̌g mbwó mɔ́b ńkwɛ́ wɔ́. ,The God who made the world and everything in it    #— #he is Lord of heaven and earth  # 17:24 Dt 10:14; Ps 115:16; Mt 11:25  #— #does not live in shrines made by hands.  # 17:24 Ac 7:48 
"À ké té ne ńzẅíʼte ngie pʉ̀a mesoŋ gÿo tsɔ́ mmó tá à lɔg ńgwɔ́ yé wó wɔ́. À tsɔ́ mmó té mbwó yé zág. Yé zɔ náa zẅìge mbwó pʉ̀a mesoŋ, tá pɔ́ lɔg ńgwɔ́ wó, tà mbɔɔ kɔ̀ɔkɔ́ɔ. ","Neither is he served by human hands, as though he needed anything,   since he himself gives everyone life and breath and all things.  # 17:25 Gn 2:7; Jb 27:3; 33:4; Zch 12:1 "
"À la fóo na tàʼ nyìŋ wémɔʼɔ́, ḿbú ńgÿo pʉ̀a mesoŋ ntsèm, légwɔ́ gie pɔ́ ge néŋe jʉʼ ntsèm ndùmo ssé tsetsáʼ. À la tʉ́ njÿó ńzáb mekèm njÿó mɔ́b mbɔɔ membàa mejʉʼ mie pɔ́ ge láʼ ńnéŋe wó. ",From one man   he has made every nationality to live over the whole earth and has determined their appointed times and the boundaries of where they live.  # 17:26 Dt 32:8; Jb 12:23; Mal 2:10 
"E Ssé gÿo púʼu, légwɔ́ gie pʉ̀a mesoŋ ge faʼa yé. Tà mbɔɔ páʼ pɔ́ lɔɔn fó faʼa yé pɔ́ lekyɛ̀bɛ lekyɛ̀bɛ, mbà ndyɛ̀ʼ tsɔ́ pɔ́ ké ńgyá yé gyá. Pege zɔɔn ńgwaa ńnéŋe páʼɔɔn, á zɔɔn ńgwɔ́ lejʉ́ŋ máa wɔ̌wɔ́ɔ tsetsɛ̀ɛ pege. ","He did this so that they might seek God, and perhaps they might reach out and find him, though he is not far from each one of us.   "
Mé zɔɔn ńgɔɔn ngie:,"For in him we live and move and have our being, as even some of your own poets have said, ‘For we are also his offspring.’   "
"Páʼ pege ee púɔ Ssé la, tà pege kwaŋ ngie e Ssé áa tsɔ́ mmó gie mé la lɔgɔ tʉ̌ ngɔ̂ɔ, kà pɔ́ tʉ̌ nkáb wɔ́ɔ, kà tóon wɔ́ɔ, ńdɔg ńnyɛte. Páʼ tsɔ́ pʉ̀a lɔgɔ legye sie é kẅɛɛ twó pɔ́b ńdɔgɔ ńnyɛte. ","Since, then, we are God’s offspring, we shouldn’t think that the divine nature is like gold or silver or stone, an image fashioned by human art and imagination.  "
"E Ssé piŋ ńké ńcʉ́ʼʉ sáŋa yɛ̌ fʉ̀ʼ gie nyìŋ mesoŋ kɔ̌ɔn ńgÿo púʼu, ńdɔgɔ ńgʉe gʉe wɔ́. Aa fʉ̀ʼɔɔn, ńne ńtóŋo ngwòŋ pʉ̀a metsèm, á tsɛ̀ɛ meláʼ ntsèm ngie pɔ́ kúbe mà wɔ́b. ","“Therefore, having overlooked   the times of ignorance, God now commands all people everywhere to repent, "
"Á zɔɔn ńgwaa gwɔ́ púʼu, mbà Ssé léen ńzába lyɛ̌ʼ gie à ge láʼ lɔgɔ nyìŋ gẅie à la tsɔ́ʼɔ yé, é ŋag njÿó, é ké ŋag pɔ́ na ntí gie ee ndʉŋndʉŋ. À la zíme ngàŋ na legwé lélɔg ńnyɛɛ mbwó mânyìŋ ntsèm ngie à ge láʼ gÿo púʼu!»",because he has set a day when he is going to judge the world in righteousness by the man he has appointed. He has provided proof of this to everyone by raising him from the dead.”  
"Pa Ngelékiya gwɔ́ tà ńjúʼ páʼ Pɔ̂ɔ gɔ̌ɔn ngie nyìŋ la zíme na legwé, etsɔ́ pʉ̀a pɔ́b gwaa zoonte yé, petsɔ́ gɔɔn né yé ngie: «Peg ge láʼa tsɔ́ lyɛ̌ʼ tá gíŋe zẅíʼte nò gie ɔ̀ gɔɔn lɛ̂!» ","When they heard about the resurrection of the dead, some began to ridicule him, but others said, “We’d like to hear from you again about this.” "
Pɔ̂ɔ cʉ́ʼ ńkẅɛɛ tsetsɛ̀ɛ pɔ́b ńgʉa gʉa. ,So Paul left their presence. 
"Tá tsɔ́ ntáʼ pʉ̀a ké ńcʉ́me nzèm yé, ńzáb ntʉ́m wɔ́b na Yěsô Keleto. Á gʉa na nùɔ yɔ́b, mé gyá Ndenísè gẅie à laa nùɔ pasáʼntsaŋ á tÿǒsoŋo Atɛ̀ne, ńgÿo tsɔ̌ manzwě gẅie mé tóŋo yé lê Ndamalísè, ńgÿo mbɔɔ tsɔ́ pʉ̀a.","However, some people joined him and believed, including Dionysius the Areopagite, a woman named Damaris, and others with them."
