ngiemboon,en
"«Mefɛ̌ pɔ́ɔn, metá pɔ́ɔn, pi zẅíʼte. N gee ḿbíte ncwò wɔ́ɔn.» ","“Brothers and fathers, listen now to my defense before you.” "
"Pa Yúndà júʼ páʼ à ne ńdɔgɔ pɔ́ kwàʼ shwóŋè láʼa yɔ́b ńgɔɔn nò, ńkẅiʼi ńdáŋte. Pɔ̂ɔ gɔɔn ngie: ","When they heard that he was addressing them in Aramaic,   they became even quieter.  # 22:1–2 Ac 7:2; 21:40 "
"«N gee múɔ Yúndà. Mé zyé wɔ́ɔn tÿǒsoŋ Táasò, á tsɛ̀ɛ pàga ngwòŋ Silisi. Mbà n da gúʼ pɔ́ Yelúzálèm wɔɔn; tà Ngamalíyɛ̀ zɔ̌ gwɔ́ tsítsà wɔ̀ɔn. À la nyɛte ńzíʼi wɔ́ɔn lepʉ̌ Pamángʉanjʉʼ pég. N daa nyìŋ, ńgáŋ nnɛ́ na nò Ssé pɔ́ páʼ pi metsèm gÿo lyɛ̌ʼɔɔn lɛ̂. ","He   continued, “I am a Jew, born in Tarsus of Cilicia but brought up in this city, educated at the feet of Gamaliel  # 22:3 Dt 33:3; Ac 5:34; 9:11; 21:39; 2Co 11:22; Php 3:5 according to the strictness of our ancestral law. I was zealous for God, just as all of you are today.  # 22:3 Ac 26:5; Rm 10:2; Php 3:6 "
"N da gwɔ́ gwɔ̌ tà ńtsɔ́ʼɔ kwò pagiŋe na mánzsè Yěsô té poŋ, ńgÿo mé gwoon mbàŋa lâ panzwě, ḿmaʼa ndátsǎŋ tà mbɔɔ páʼ mé lɔ́ɔn ńgwɔ́ mé tóo wó ńzẅé wɔ́b zẅé. ","I persecuted this Way   to the death, arresting and putting both men and women in jail,  # 22:4 Ac 8:3; 22:19–20; 26:10 "
"Tándá panuŋepwɔʼ, mbɔɔ cúʼtè pasáʼa láʼ yɔɔn, ne ńzsé ngie anò gie n gɔɔn áa nénʉ́. Pɔ́ zɔ̌ la zɔɔn ńná meŋwàʼne ńdɔg ńtúmo wɔ́ɔn ngie n gʉa ńnyɛɛ mbwó mefɛ̌ pégè pà Yúndà pie ée tsɛ̀ɛ tÿǒsoŋ Ndamásè. Á gwɔ́ ngie n gwoon pʉ̀a Keleto, ńdɔgɔ wɔ́b ḿbiŋ nzèm né Yelúzálèm. Légwɔ́ gie mé ge gÿo pɔ́ gyá ngɔ́ʼ.»","as both the high priest and the whole council of elders can testify about me. After I received letters from them to the brothers, I traveled to Damascus to arrest those who were there and bring them to Jerusalem to be punished.  "
"N cʉ́me mánzsè, ńgʉa tà ńcʉ́ʼʉ lékúu Ndamásè, á gwɔ́ kwàʼ tsɛ̀ɛ zsǒ, n gwóon ńgyá, atsɔ́ kyɛ̀ʼ fó tÿǒ lepwó, ḿbú ńkyɛʼɛ jʉʼ gie n daa wó. ","“As   I was traveling and approaching Damascus, about noon an intense light from heaven suddenly flashed around me. "
"N gwe ssé, ńgwóon ńjúʼ ngyè nyìŋ gɔɔn lé mèŋ ngie: «Sɔ̂ɔ, Sɔ̂ɔ, ɔ̀ tsɔ́ʼɔ kwò yɔ́ɔn té poŋ mélàʼakɔ́?» ","I fell to the ground and heard a voice saying to me, ‘Saul, Saul, why are you persecuting me? ’"
"N zɛ́te ngie: «Aa gù wɔ̌ Cʉ̀apʉ̀a?» Angàŋ tsɔ́ʼ ngie: «N gee Yěsô, nyìŋ Nǎzalɛd. Ɔ̀ tsɔ́ʼɔ páʼa pɔ́ kwò yɔ́ɔn té poŋ.» ","“I answered, ‘Who are you, Lord? ’"
"Epʉ̀a pie peg lâ pɔ̌ kɔʼɔ́ ńgwɔ́ nùɔ gyá páʼ ammó kyɛ̌ʼ jʉʼ táʼ, ńké te júʼ ngyè nyìŋ gẅie à gɔɔn nò lé mèŋ wɔ́. ","Now those who were with me saw the light,   but they did not hear the voice of the one who was speaking to me.  # 22:9 Dn 10:7; Ac 9:7; 26:13"
"N zɛ́te yé ngie: «Cʉ̀apʉ̀a, n gÿo lêkɔ́?» Cʉ̀apʉ̀a tsɔ́ʼɔ mbwó mèŋ ngie: «Lu ssé, ńgʉa Ndamásè. Ɔ̀ ge kúu wó tá mé shwóŋo gú kɔ̀ɔkɔ́ɔ wɔ́ɔ gie á ne ńzɛ́te ngie ɔ̀ gÿo.» ","“I said, ‘What should I do, Lord? ’"
"N da gwaa gwɔ́, mbà mmó pǔ ńkyɛʼ nÿɔ́g mɔ́ɔn tà mèŋ fʉ. Epʉ̀a pie peg lâ pɔ̌ é keʼé ńgwɔ́ nùɔ leen ńké ńkíbe pwó yɔ́ɔn, ńtsege wɔ́ɔn tÿǒsoŋo Ndamásè.","“Since I couldn’t see because of the brightness of the light,   I was led by the hand by those who were with me, and went into Damascus.  # 22:10–11 Ac 9:8; 16:30 "
"Ńkúu wó, atsɔ̌ nyìŋ gwɔ́ wó. Mé tóŋo yé lê Ananiyásè. Á gwɔ́ nyìŋ ńgÿo mekùʼ Ssé kwàʼ páʼ lepʉ̌ ségè ne ńzɛ́te. Pa Yúndà pie é tsẅé tÿǒsoŋo Ndamásè tà ḿmaga wɔ́b pɔ́ kíme yé pɔ́ mboŋó. ","Someone named Ananias, a devout man according to the law, who had a good reputation with all the Jews living there,   "
"Ananiyásè tó ńgyá wɔ́ɔn, ńgɔɔn né mèŋ ngie: «Afɛ̌ wɔ̀ɔn Sɔ̂ɔ, gíŋe ńzye légyá jʉʼ.» N gwóon ńtyé pɔ́ fʉʼó, menÿɔ́g mɔ́ɔn nyɛ́ʼɛ tà n cwoŋo ńgyá Ananiyásè ","came and stood by me and said, ‘Brother Saul, regain your sight.’ And in that very hour I looked up and saw him. "
"Á gíŋe ńgɔɔn ngie: «E Ssé pamángʉanjʉʼ pégè léen ńtʉ́ njÿó ńtsɔ́ʼɔ gú, á lélɔgɔ gú ńgÿo nyìŋ gẅie à ge zsé mmó gie à la zába légÿo, mbɔɔ légÿo ɔ̀ gyá nyìŋ gẅie aa ndʉŋndʉŋ gíle yé, mbɔɔ léjúʼ ngyè wɛ̌ nyìŋ. ","And he said, ‘The God of our ancestors has appointed   you to know his will, to see  # 22:14 1Co 9:1; 15:8 the Righteous One,  # 22:14 Ac 3:14; 7:52 and to hear the words from his mouth, "
"Ɔ̀ zɔɔn ńtyé pɛ́ʼɛ̀, ńgẅiin légʉa jʉʼ ntsèm ndùmo ssé tsetsáʼ, éshwóŋ pʉ̀a nò gie ɔ̀ zsé na yé. Á gie ɔ̀ gyǎ, mbɔɔ gie ɔ̀ jǔʼ. ",since you will be a witness for him to all people of what you have seen and heard.   
"Ɔɔ fʉ̀ʼɔɔn ńnyé ńzẅíʼte kɔ́. Lu ssé ńtó, mé lɔg lezíŋ sé ńnuʼu gú ntse, ńdɔg sɔg menò tepòŋ mú.»","And now, why are you delaying? Get up and be baptized, and wash away your sins,   calling on his name.’  # 22:16 Ac 9:14; Rm 10:13"
"«M bɔ́ɔnte ḿbiŋe Yelúzálèm, ńgwɔ́ tsɔ́ lyɛ̌ʼ ńgwɔ́ tsɛ̀ɛ ndá Ssé ne sẅíŋte Ssé, Yěsô tó ńnyɛ mbùm yé mbwó mèŋ. ","“After I returned to Jerusalem and was praying in the temple, I fell into a trance   "
"N gyá yé, á gɔɔn né mèŋ ngie: “Sẅɛte fó Yelúzálèm wɔɔn ńgʉa, mélàʼmie pʉ̀a pie é tsẅe wó té ge zẅíŋe nò gie ɔ̀ ge shwóŋo wɔ́b, é tíi wɔ́ɔn mɔ́.” ","and saw him telling me, ‘Hurry and get out of Jerusalem quickly, because they will not accept your testimony about me.’"
"N tsɔ́ʼ ngie: “Cʉ̀apʉ̀a, pɔ́ ne ńzsé mboŋó páʼ n dɔ̌ɔn ńgwá ńkʉ́ʼʉ tsɛ̀ɛ mendá cúʼtè pà Yúndà ńgwoon pʉ̀a pie é záb ntʉ́m na gù, ńnéŋe wɔ́b ndátsǎŋ, ḿbiŋ ńgÿo mé lɔgɔ mengwɔɔn ńcúɔ wɔ́b. ","“But I said, ‘Lord, they know that in synagogue after synagogue I had those who believed in you imprisoned and beaten.   "
"Mé la gwaa zẅé Etiyeen gẅie à la ne shwóŋo pʉ̀a nò gie à zsé na gù, n gwɔ́ yɔ́ɔn ssé. Peg lâ pʉ̀a pie é la zẅé yé laa tàʼ ncwò; tà pɔ́ gwɔ́ témte yé lé metóon, é zẅé, n ne ḿbyɛ́bɛ menzsǒ mɔ́b.” ","And when the blood of your witness Stephen was being shed, I stood there giving approval   and guarding the clothes of those who killed him.’  # 22:20 Ac 7:58; 8:1; Rm 1:32"
"Cʉ̀apʉ̀a leen ńké ńgɔɔn né mèŋ ngie: “Lwo, n túmo gú páʼɔɔn ngʉ̀a shʉ̀shʉ̀a, á tsetsɛ̀ɛ pʉ̀a pie é té pà Yúndà wɔ́.”»","“He said to me, ‘Go, because I will send you far away to the Gentiles.’  ”  "
"Pa Yúndà pie é la zẅíʼte nò gie Pɔ̂ɔ ne ńgɔɔn, tà ńjúʼ á gɔɔn páʼ à gɔ̌ɔn lɔɔn, la leen ńkwéʼe ngyè yɔ́b, ńnáa tÿǒ ńgɔɔn ngie: «Mè véle shÿó ntí nyìŋ wɛ̂, á ndùmo ssé tsetsáʼ. À te gẅie à lɔɔn ńgwɔ́ mé nyé yé, á gíŋe ńgwɔ́ wó wɔ́!» ","They listened to him up to this point. Then they raised their voices, shouting, “Wipe this man off the face of the earth! He should not be allowed to live! ”  "
"Ńgÿo pɛ́ʼɛ̀, ńne ńdíte ngwòŋ, ńne ńcʉʼte menzsǒ mɔ́b, ńŋwaa pfepfɔ́b ḿmaʼa tÿǒ. ","As they were yelling and flinging aside their garments and throwing dust into the air,   "
"Tándá metándá ncù pà Loma, leen ńké ńtsẅi ngie palÿɔ́ʼncù lɔgɔ yé ḿbiŋe tsɛ̀ɛ nkáʼ pɔ́b, ńdɔg ngwɔɔn ńnyɛte ńcúɔ yé, ńtsóte yé à gɔɔn mmó gie aláʼ kwʉŋe yé mǒ. ","the commander ordered him to be brought into the barracks, directing that he be interrogated with the scourge to discover the reason they were shouting against him like this. "
Mé zye lékwɛ́ɛ Pɔ̂ɔ páʼ mé gee ńcúɔ yé. Á gɔɔn mbwó tándá ncù gẅie aa jʉʼó ngie: «Mé ge líe líe pi cúɔ múɔ láʼ pà Loma té mé zɔɔn fó ńŋaga yé wɔ́? Awɔ̌ tsẅi púʼu?» ,"As they stretched him out for the lash, Paul said to the centurion standing by, “Is it legal for you to scourge a man who is a Roman citizen and is uncondemned? ”  "
"Á júʼ ḿvege, ńkÿote ńgʉa ńgyá tándá wɔ́b, ńgɔɔn né yé ngie: «Ɔ̀ ge gÿo lêkɔ́? Ambàŋa wa aa múɔ láʼ pà Loma!» ","When the centurion heard this, he went and reported to the commander, saying, “What are you going to do? For this man is a Roman citizen.”"
"Tándá wɔ́b júʼ yé, ńtó tà ńkúu lejʉ́ŋ Pɔ̂ɔ, ńzɛ́te ngie: «Shwóŋo wɔ́ɔn, mé gɔ̌ɔn ngie ɔ́ɔ múɔ láʼ pà Loma lá?» Pɔ̂ɔ tsɔ́ʼ ngie: «Oon!» ","The commander came and said to him, “Tell me, are you a Roman citizen? ”"
"Tándá metándá ncù gɔɔn né yé ngie: Mé la láʼ ńgwaa zẅíŋ ngie n cʉʼʉ́ múɔ láʼ pà Loma, n cʉŋ nkáb mǒ tà e te kɔ́g. Tá Pɔ̂ɔ tsɔ́ʼ yé mbwó yé ngie: Ɛɛ! Á gʉa na mèŋ, mbà mé la zyé wɔ́ɔn, n gwɔ́ pɔ́ múɔ láʼ pà Loma. ","The commander replied, “I bought this citizenship for a large amount of money.”"
"Epʉ̀a pie é kɔʼɔ́ ńtyé lécúɔ Pɔ̂ɔ, á lélɔg ńgÿo á gɔɔn nò, fó lejʉ́ŋ yé ńkÿo. Tándá metándá ncù zsé ngie à ně fʉa légÿo mé kwɛ́ɛ múɔ láʼ pà Loma lé metsɛ̂n, ńtyé ńcʉ́ʼʉ ḿbɔ́gɔ pɔ̌g.",So those who were about to examine him withdrew from him immediately. The commander too was alarmed when he realized Paul was a Roman citizen and he had bound him.  
"Njÿó gÿo ńdʉ́a, Tándá metándá ncù faʼa lékwaʼ ńnyɛte ńzsé mmó gie pà Yúndà ka gwaa púte Pɔ̂ɔ, ḿbúte yé ńtíi yɛ̌, ńtsẅi mé kyɛ́ʼ metsɛ̂n na yé, ńgíŋe ńtsẅi mé tóŋ metándá panuŋepwɔʼ lâ petsɔ́ pasáʼntsaŋ pà Yúndà, ńdeen ńké ńgÿo mé lɔgɔ Pɔ̂ɔ ńcwóŋ, ńtó ńtÿɔ́gɔ yé mvfò pɔ́b.","The next day, since he wanted to find out exactly why Paul was being accused by the Jews, he released him   and instructed the chief priests and all the Sanhedrin to convene.  # 22:30 Mt 5:22; Ac 23:3–8 He brought Paul down and placed him before them."
