ngiemboon,en
"Páʼ pi lâ Keleto la púte ńzíme na legwé la, pi tÿɔ́g lejÿɔ́g sí pɔ́ na shúm sie ée tÿǒ lepwó, ajʉʼ gie Keleto aa wó, ńnéŋe na gwoŋó pwó Ssé yetʉ. ","So if you have been raised with Christ, seek the things above, where Christ is, seated at the right hand of God.   "
"Pi nɔ́ɔnte pɔ́ mmó gie áa tÿǒ lepwó, tà pi nɔ́ɔnte gie áa ndùmo ssé tsetsáʼ. ","Set your minds on things above, not on earthly things.   "
"Pi zsé ngie áa na menò njÿó, mbà pi léen ńkwé. Agẅi legwɔ́ wó, aa mbwó Keleto á lejʉ́ŋ Ssé, mé té ne ńgyá páʼ à gwɔ̌ wɔ́. ","For you died,   and your life is hidden with Christ in God. "
"Keleto zɔɔ kwàʼ gẅi legwɔ́ wó. À ge láʼ gwɔ́ tà kẅɛ, pi gíŋe ńkẅɛ gí, pi lâ pɔ̌ zɔ púte ńgwɔ́ tsɛ̀ɛ legúʼ we.","When Christ, who is your   life, appears,  # 3:4 2Co 4:11; 1Jn 1:2; 2:28 then you also will appear with him in glory.  # 3:4 Lk 9:32; Jn 17:24; 2Co 3:18; 2Pt 3:18"
"Páʼ áa púʼu la, pi pyága mà tepòŋ we ndùmo ssé tsetsáʼ gẅie aa na pi. Mé gɔɔn mmó páʼ mbàŋa léfaʼ panzwě, é panzwě léfaʼ mbàŋa, á mmó páʼ nò mpfwɔ̀ʼ, á mmó páʼ ntʉ́m nyìŋ légwá shÿó, páʼ legẅiin tsɔ́ ntí letsɔ̌ɔn shúm, páʼ letÿɔ̌g ntʉ́m na shúm, á nue letÿɔ̌g ntʉ́m na shúm, à giŋé ńgwɔ́ pɔ́ tsɔ̌ ntí leguʼte shúm ngie ée Ssé. ","Therefore, put to death what belongs to your earthly nature: sexual immorality, impurity,   lust,  # 3:5 Rm 1:26; 1Th 4:5 evil desire, and greed,  # 3:5 Eph 5:3 which is idolatry.  # 3:5 1Co 10:14; Gl 5:20; 1Pt 4:3 "
"Mɔɔn ée menò mie é gÿo e Ssé gyáŋa lóŋ na pʉ̀a pie é té ne ńjúʼu ncwò wé wɔ́, ","Because of these, God’s wrath   is coming upon the disobedient,  # 3:6 Other mss omit upon the disobedient "
"ée menò mie pi ka ne ńgÿo, á fʉ̀ʼ gie mɔɔn menò tepòŋ ka nyě ésáʼa gẅí.",and you once walked in these things when you were living   in them. 
"Táʼ, á ké ńgwɔ́ fʉ̀ʼɔɔn, ńne ńzɛ́te ngie pi gwáʼ mɛ̌ menò. Mé gɔɔn menò páʼ nyìŋ gẅi légyáŋa lóŋ, á nyìŋ gẅi lénéŋe ńcÿɔ́g cÿɔ́g, á nyìŋ gẅi lézáʼ lekwɔɔn nyìŋ, á nyìŋ gẅi lézoon nzòon, mbɔɔ shwóŋè tepòŋ légíŋe ńkẅɛɛ ncwò pi. ","But now, put away   all the following: anger,  # 3:8 Jms 1:19 wrath,  # 3:8 Rv 14:19 malice,  # 3:8 1Co 14:20 slander,  # 3:8 Jn 10:33; Rv 13:6 and filthy language from your mouth.  # 3:8 Eph 4:22–31 "
"Páʼ pi kéen ńgwáʼa nzẅìŋe mà pâ menò mé la, e cÿɔ̌nò pɔ́ɔn légíŋe ńgwɔ́ tsetsɛ̀ɛ pi. ","Do not lie   to one another, since you have put off  # 3:9 Col 2:15 the old self  # 3:9 Eph 4:22 with its practices "
"Pi ee pɛ́ʼɛ̀, mbà pi ka kaa mà we nyìŋ sẅé, ḿmaʼa mbùm pi. Wɛ̌ mà fóo mbwó Ssé. Yé zɔ̌ ne ńtáŋte ngwòŋ fʉ̀ʼ ntsèm légwɔ́ gie à ge sẅé we. E Ssé gÿo púʼu, légwɔ́ gie pi ge pú zsé yé. ",and have put on   the new self. You are being renewed in knowledge according to the image of your  # 3:10 Lit his Creator.  # 3:10 Mk 13:19; Jn 1:3; Rv 3:14 
"Páʼ pi metsèm kéen ńcʉ́ʼ pʉ̀a pe mesẅé la, atyɛ̀ʼte té gẅiin légíŋe ńgwɔ́ tsetsɛ̀ɛ pi tà áa gie mé ge gíŋe gɔɔn ngie: Wɔɔn aa nyìŋ Ngelékiya, wɔɔn gwɔ́ nyìŋ pà Yúndà wɔ́. Mé le gíŋe ńgɔɔn ngie wɔɔn aa nyìŋ gẅie mé la púʼu yé, wɔɔn gwɔ́ nyìŋ gẅie mé la te yé púʼ wɔ́. Kà pɔ́ légíŋe ńgɔɔn ngie wɔɔn la zíʼi ŋwàʼne, wɔɔn te zíʼi wɔ́ wɔ́. Mé ké le gíŋe ńgɔɔn ngie wɔɔn nyìŋ aa nkwɔɔn, wɔɔn te nkwɔɔn wɔ́ wɔ́. Keleto zɔ cʉ̌ʼ ńgwɔ́ gí nò ntsèm, ńgwɔ́ ntʉ́m pi metsèm.","In Christ there is not Greek and Jew, circumcision and uncircumcision, barbarian, Scythian, slave and free; but Christ is all and in all.  "
"E Ssé la kwoŋo gẅí, ńtsɔ́ʼɔ gẅí, ńdɔg ńgÿo pʉ̀a pé. Púʼu la, pi píi mà wesẅé ḿmaʼ, ńtsɔ́ɔn mezìŋe petsɔ́ pʉ̀a tɛʼ, ńgẅiin pòŋontʉ́m, ńná nnɛ́ ssé, ńgwɔ́ ngàŋ mbʉ́lè, ńgẅiin shÿɔgɔ ntʉ́m. ","Therefore, as God’s chosen ones, holy and dearly loved,   put on compassion, kindness,  # 3:12 2Co 6:6 humility,  # 3:12 Ac 20:19; Eph 4:2; Php 2:3; Col 2:18,23; 1Pt 5:5 gentleness,  # 3:12 Jms 3:13 and patience,  # 3:12 2Tm 3:10 "
"Pi gẅiin shÿɔgɔ ntʉ́m tsetsɛ̀ɛ pi, nyìŋ gẅi fʉa nò, pi lege ńnáa mbwó yé, ńdege mefʉa mí tsetsɛ̀ɛ pi né pi, páʼ Cʉ̀apʉ̀a wege la lege mefʉa mí gí la. ","bearing with one another and forgiving one another if anyone has a grievance against another. Just as the Lord has forgiven you, so you are also to forgive.   "
"Anò gie á cʉa mɔɔn menò ntsèm, aa pi légẅiin nkwòŋe tsetsɛ̀ɛ pi né pi. Nkwòŋe ee nkenkÿo gẅie é ge kwɛ́ɛ gẅí, é lɔg gÿo tàʼ mbwɔ̀ʼ páʼ á ne ńzɛ́te ngie pi temte púʼu. ","Above all, put on love, which is the perfect bond of unity. "
"N ne ńtsɔ́ɔn ngie mbʉ́lè gie e fóo mbwó Keleto, e jÿó ntʉ́m gẅí. E Ssé la tóŋo gẅí metsèm légwɔ́ gie pi ge gẅiin mbʉ́lè ŋwɛ́, páʼ pi ge gwɔ́ mekèm tàʼ mbùm nnɛ́. Pi ké ńgwɔ́ fʉ̀ʼ ntsèm, ńne ńnáa ndǎg mbwó Ssé. ","And let the peace of Christ, to which you were also called   in one body, rule your hearts. And be thankful. "
"Á poŋ ngie pi lɔgɔ shwóŋè Keleto ńzye ntʉ́m gẅí kwàʼ mboŋó. À cʉa púʼu, pi gẅiin zsénò lélɔg ńzíʼi mmó tsetsɛ̀ɛ pi, mbɔɔ lélɔg ńtÿɔ́gte mennɛ́ mí. Pi zɔb ntse, ńdɔg ńguʼte Ssé né ngwòŋ ntʉ́m gẅí ntsèm, ńdɔg ńná ndǎg mbwó yé. Pi zɔbɔ púʼu, é mezɔ̀b mie ée tsɛ̀ɛ Ŋwàʼne Ssé, ńzɔbɔ zɔ̀bɔ pʉ̀a Keleto, ńzɔb mezɔ̀b mie Zẅìge Ssé ne ńnéŋe ntʉ́m pi. ","Let the word of Christ dwell richly among you, in all wisdom teaching and admonishing one another through psalms, hymns, and spiritual songs,   singing to God with gratitude in your hearts. "
"Pi lɔɔn ne ńgÿo pɔ́ kɔ́ wɔ́ɔ, kà shwóŋo pɔ́ kɔ́ wɔ́ɔ, pi tÿɔ́g pɔ́ lezíŋ Cʉ̀apʉ̀a Yěsô mvfò, ńne ńnáa ndǎg mbwó Tá wege Ssé, ńcʉa na Yěsô.","And whatever you do, in word or in deed, do everything in the name   of the Lord Jesus, giving thanks to God the Father through him."
"Pi panzwě pie pi zɔ̌ʼ, wɛ̌ nyìŋ wɔ́ɔ na pi, ná mbùm ye ssé mvfò ndúm we. Áa páʼ á poŋ ngie manzwě gẅie à la nnɛ́ na Cʉ̀apʉ̀a, à gÿo.","Wives, submit yourselves to your husbands, as is fitting in the Lord.   "
"Pi mbàŋa pie pi zɔ̌ʼ, wɛ̌ nyìŋ wɔ́ɔ na pi kwoŋo nzwě we, tà á gÿo, nzwě we cʉ́ʼʉ ngàŋngɔ́ʼ.","Husbands,   love your wives  # 3:19 Eph 5:25; 1Pt 3:1 and don’t be bitter  # 3:19 Rv 8:11; 10:9–10 toward them. "
"Pi penkʉ́, pi júʼ ncwò metá pí lâ we memá pí na kɔ̀ɔkɔ́ɔ, á nue áa mmó gie á poŋo Cʉ̀apʉ̀a.","Children,   obey your parents in everything, for this pleases the Lord. "
"Pi metá penkʉ́, tà pi lába lóŋ penkʉ́ pí, ḿbɔ́g mbùm yɔ́b létsyɛte.","Fathers,   do not exasperate  # 3:21 2Co 9:2 your children, so that they won’t become discouraged. "
"Pi menkwɔɔn, pi júʼ ncwò pʉ̀a pie é gẅiin gẅí ndùmo ssé tsetsáʼ, á na kɔ̀ɔkɔ́ɔ. Pi pɔ́ɔn léfaʼa fàʼ pɔ́ ndàʼ fʉ̀ʼ gie pɔ́ tyé nzèm pi páʼ fʉ̀ʼ gie pi gÿo pɔ́ mmó gie á ge poŋ pʉ̀a mesoŋ la. Pi faʼ né ngwòŋ ntʉ́m gẅí ntsèm, ńtí páʼ pi ne ńnáa mekùʼ Cʉ̀apʉ̀a. ","Slaves, obey your human   masters in everything. Don’t work only while being watched, as people-pleasers, but work wholeheartedly, fearing the Lord.  # 3:22 Pr 1:7; Rv 14:7 "
"Mé lɔɔn ńná yɛ̌ ntí fàʼ wɔ́ɔ né pi, pi fàʼ pɔ́ né ntʉ́m mbòŋo, páʼ fʉ̀ʼ gie pi faʼa pɔ́ mbwó Cʉ̀apʉ̀a tà pi těen faʼa pɔ́ mbwó pʉ̀a mesoŋ wɔ́ la. ","Whatever you do, do it from the heart, as something done for the Lord and not for people,   "
"Tà pi lege ngie Cʉ̀apʉ̀a zɔ ge láʼ tsɔ́ʼɔ fàʼa gí, é gʉa na tÿɔgɔ́ pʉ̀a pé, é ná gẅí, á nue yé zɔɔ kwàʼ nyìŋ gẅie pi faʼa mbwó yé. ",knowing that you will receive the reward of an inheritance from the Lord. You serve the Lord Christ. 
"Tá ńké ńgwɔ́ gie nyìŋ lɔɔn ńgÿo mmó gie Ssé te kwoŋ, mbà Keleto ge láʼ ná pɔ́ mmó gie á kuʼu na yé né yé, á nue e Ssé ee těen ńtuŋo metuŋ wɔ́.","For the wrongdoer   will be paid back for whatever wrong he has done, and there is no favoritism."
