ngiemboon,en
"Afùɔ Ezekiyásè la gwɔ́ tà ńjúʼu yɔɔn nò, éshʉate menzsǒ mé, ńkaa pɔ̀ɔn éshu, ńdɔg ńdúŋ, ńgʉa né ndá Cʉ̀apʉ̀a. ","When King Hezekiah heard their report,   he tore his clothes, covered himself with sackcloth,  # 37:1 Gn 37:34; 2Sm 3:31; 1Kg 21:27; Is 3:24 and went to the Lord’s temple. "
"Ńdeen ńké ńtúmo Eliakim gẅie yé zɔ pǔ ńdíe shúm nɔʼ, pɔ́ Shʉbna gẅie aa ntẅènzóŋ, lâ panuŋepwɔʼ pie é cÿɔgté, ngie pɔ́ gʉa ńgyá Esǎyà gẅie aa ntsẅìnkʉ̀ Ssé, ńgwɔ́ míŋ Ámɔ́sè. Pɔ́ gwaa gʉa gyá Esǎyà, ńgíŋe ńkaa yɔ́b mepɔ̀ɔn éshu, ńdɔg ńdúŋ. ","He sent Eliakim, who was in charge of the palace, Shebna the court secretary, and the leading priests, who were covered with sackcloth, to the prophet Isaiah son of Amoz. "
"Ńkú ńtsẅi né yé ngie: «Ezekiyásè gɔ̌ɔn ngie: alyɛʼɛ́ láʼ yɔɔn, áa mbwó peg, ńgwɔ́ lyɛʼɛ́ cʉanò, ńgwɔ́ lyɛʼɛ́ ngʉ̀ngʉ̀, ńgwɔ́ lyɛʼɛ́ shʉ́. Mé ée ńgɔɔn ngie múɔ kǔʼ páʼ mé ge zyé yé táʼ, máa te gẅiin metʉ̀ lélɔg ńtsẅíŋe yé tà á kẅɛ wɔ́. ","They said to him, “This is what Hezekiah says: ‘Today is a day of distress, rebuke, and disgrace.   It is as if children have come to the point of birth, and there is no strength to deliver them.  # 37:3 Is 26:17–18; 66:9; Hs 13:13 "
"Afùɔ ngwòŋ Asili tumó tándá palÿɔ́ʼncù pé, á tó ńzoonte Ssé gie ee ntʉ̀ntʉ̀. Ngwɔ́ Cʉ̀apʉ̀a, é Ssé jù júʼ mɔɔn menzòon, ńtém ngʉ̀ngʉ̀ twó yé ńtí nò gie à gɔ̌ɔn! Gù Esǎyà, sẅíŋte Cʉ̀apʉ̀a na twó pʉ̀a pé pie é ka tsẅɛ̌. ","Perhaps the Lord your God will hear all the words of the royal spokesman, whom his master the king of Assyria sent to mock the living God,   and will rebuke him for the words that the Lord your God has heard. Therefore offer a prayer for the surviving remnant.’ ”  # 37:4 Is 1:9; 46:3"
"Pɔ́ la gwɔ́ tà ńgʉa ńtsẅi né Esǎyà púʼu, ","So the servants of King Hezekiah went to Isaiah, "
"á gɔɔn né pɔ́b ngie: “Nkʉ̀ Cʉ̀apʉ̀a gẅie pi ge gʉa tsẅi né táfàʼ gẅi e wɔɔn: Te pɔ́gɔ tsɔ́ mmó ńtí menò mie ɔ̀ jǔʼ, é meshwóŋè mie megàŋafàʼ fùɔ Asili lɔ̌g ńzoonte wɔ́ɔn. ","who said to them, “Tell your master, ‘The Lord says this: Don’t be afraid   because of the words you have heard, with which the king of Assyria’s attendants have blasphemed me.  # 37:6 Ps 44:7,13–16; Is 52:5; Rm 2:24 "
"Etsɔ́ nkʉ̀ ge sẅɛ́ʼɛ mbwó fùɔ wɔ́b, à vɔg tà ńjúʼ, ḿbiŋ nzèm né láʼ yé. É piŋ tà kúu wó, n gÿo mé lɔg nně ncù ńzẅé yé.”»","I am about to put a spirit   in him and he will hear a rumor and return to his own land, where I will cause him to fall by the sword.’ ”  # 37:7 Is 37:36–38"
Tándá palÿɔ́ʼncù gẅie aa nyìŋ Asili júʼ ngie fùɔ fǒ Lakíshÿè ńgʉa. Ńgee púʼu lélÿɔ́ʼɔ tÿǒsoŋo Libna; tándá palÿɔ́ʼncù gʉa ńtsɛ́ɛ yé jʉʼó. ,"When the royal spokesman heard that the king of Assyria had pulled out of Lachish,   he left and found him fighting against Libnah.  # 37:8 Nm 33:20; Jos 10:29 "
"Pɔ́ fʉʼó ŋwɛ́, afùɔ ngwòŋ Asili júʼ tsɔ́ nkʉ̀ gẅie é líe Tilaka gẅie aa fùɔ Kushʉ̀, ngie à ne ńtóo lélÿɔ́ʼɔ yé lé ncù. Á júʼ púʼu, ńdeen ńtúm memántúm mbwó Ezekiyásè ","The king had heard concerning King Tirhakah of Cush,   “He has set out to fight against you.” So when he heard this, he sent messengers to Hezekiah, saying, "
"gẅie aa fùɔ Yúndà. Pɔ́ gʉa ńgɔɔn né yé ngie: «Ɔ̀ ne ńdɔgɔ Ssé jù ńtʉʉ, ńne ńkwaŋa ngie ńgwɔ́ á táte wɔ́ɔn, mèŋ fùɔ Asili légwoon tÿǒsoŋo Yelúzálèm ńkẅé. Te zẅíŋ á fʉte gú. ","“Say this to King Hezekiah of Judah: ‘Don’t let your God, on whom you rely, deceive you   by promising that Jerusalem won’t be handed over to the king of Assyria. "
"Kwàʼ gù ne ńzsé menò mie mefùɔ Asili la tɔ́ɔn na metsɔ́ mengwòŋ ntsèm; pɔ́ la pú ńdége wɔ́b, ńgʉa na gù, mbà ɔ̀ kwǎŋ ngie gù zɔ ge tsɔgɔ la? ","Look, you have heard what the kings of Assyria have done to all the countries: they completely destroyed them. Will you be rescued? "
"Mefùɔ pie é ka zɔɔn ḿvɔg sáʼa láʼ tá n néŋe yɔ́ɔn na lʉŋ, pɔ́ la pyága tÿǒsoŋo Ngozaŋ, ḿbyága tÿǒsoŋo Alaŋ, ḿbyága tÿǒsoŋo Lesɛfe, ḿbyág gubé Éndèn gie ée Telasaa. Messé mɔ́b la te kuʼu lékẅé twó sɔ́b wɔ́. ","Did the gods of the nations   that my predecessors destroyed rescue them #— #Gozan,  # 37:12 2Kg 17:6; 18:11 Haran,  # 37:12 Gn 11:31; 12:1–4; Ac 7:2 Rezeph, and the Edenites in Telassar? "
"Afùɔ Amad, aa nzɔ̌; afùɔ Alepad gwɔ́ nzɔ̌, afùɔ tÿǒsoŋo Sefavayîm gwɔ́ nzɔ̌, awe Hénà gwɔ́ nzɔ̌, awe Ava gwɔ́ yé nzɔ̌?»","Where is the king of Hamath, the king of Arpad, the king of the city of   Sepharvaim, Hena, or Ivvah? ’ ”"
"Ezekiyásè la kẅé ŋwàʼne gie memántúm lɔ̌g ńtó, ńtóŋ. Ńdeen ńké ḿbʉ né ndá Cʉ̀apʉ̀a, ńnuŋe ŋwàʼne mvfò Cʉ̀apʉ̀a. ","Hezekiah took the letter from the messengers’ hands, read it, then went up to the Lord’s temple and spread it out before the Lord.   "
Ésẅíŋte yé ngie: ,Then Hezekiah prayed   to the Lord:
"«Cʉ̀apʉ̀a gẅie à piʼi kɔ̀ɔkɔ́ɔ, e Ssé Ésàlayɛ, gù gẅie ɔ̀ neŋé, mekɛlẅimbeŋ tÿɔ́ʼte gú, gù zɔɔ ndàʼ Ssé gie e pǔ ńgwɔ́ tsɛ̀ɛ meláʼa ntsèm ndùmo ssé tsetsáʼ. Gù zɔ la nyɛte lefaŋ pɔ́ tsetsáʼ. "," Lord of Armies, God of Israel, enthroned between the cherubim,   you are God  # 37:16 Dt 10:17; 2Sm 7:28; Ps 86:10; 90:2; 136:2–3  #— #you alone  # 37:16 1Kg 8:39; Neh 9:6; Ps 4:8; 83:18; 86:10; Rv 15:4  #— #of all the kingdoms of the earth.  # 37:16 2Ch 36:20; Ps 68:32; Rv 11:15 You made the heavens and the earth.  # 37:16 Ex 20:11; Neh 9:6; Ps 146:6; Ac 4:24 "
"Cʉ̀apʉ̀a, téŋe tuŋó jú ńjúʼ, cwoŋo ńdíe, júʼ meshwóŋè ntsèm mie memántúm Senakelib lɔ̌g ńzoonte gú, á gú gẅie ɔɔ Ssé gie ee ntʉ̀ntʉ̀! ","Listen closely, Lord, and hear;   open your eyes, Lord, and see.  # 37:17 Is 42:5; 45:12; Jr 10:12 Hear all the words that Sennacherib has sent to mock the living God.  # 37:17 Is 37:4 "
"Cʉ̀apʉ̀a, áa nénʉ́ ngie mefùɔ ngwòŋ Asili ka pǔ ḿbyág pʉ̀a tsɛ̀ɛ tsɔ́ meláʼ, ńjÿó mengwòŋ mɔ́b. ","Lord, it is true that the kings of Assyria have devastated all these countries and their lands. "
"Ńgÿo púʼu, ńkate messé mɔ́b ńtéme mmɔ̌g, ḿbú ḿbyága wɔ́b. Ńtéme mmɔ̌g púʼu, é zɔɔn te kwaʼ messé wɔ́; é ka gwɔ̌ pɔ́ metútú mie pʉ̀a mesoŋ la lɔgɔ tÿǒ lâ tóon ńnyɛte. ","They have thrown their gods into the fire, for they were not gods   but made from wood and stone  # 37:19 Dt 4:28; 28:36,64; 29:17; Ezk 20:32 by human hands.  # 37:19 Is 2:8,20; 17:8; 31:7; 41:24,29; 44:9–20; 46:6 So they have destroyed them. "
"Afʉ̀ʼɔɔn la, gù Cʉ̀apʉ̀a Ssé yeg, kẅé wég mbwó Senakelib; à cʉa púʼu, meláʼ ntsèm mie ée ndùmo ssé tsetsáʼ, e zsé ngie gù Cʉ̀apʉ̀a, ée ndàʼ gú, ńgwɔ́ Ssé.»","Now, Lord our God, save us from his power so that all the kingdoms of the earth may know that you, Lord, are God  ,# 37:20 Jos 4:24; 1Kg 8:60; 20:13; Is 45:3,6  #— #you alone.  # 37:20 Is 37:16"
"Esǎyà míŋ Ámɔ́sè wembàŋa leen ńké ńtúm nkʉ̀ mbwó Ezekiyásè ngie: «Yɔɔn áa mmó gie Cʉ̀apʉ̀a, é Ssé Ésàlayɛ, à gɔ̌ɔn ńtí sẅíŋtè gie ɔ̀ ka gÿo ńtí Senakelib gẅie aa fùɔ ngwòŋ Asili. ","Then Isaiah son of Amoz sent a message to Hezekiah: “The Lord, the God of Israel, says, ‘Because you prayed to me about King Sennacherib of Assyria, "
Ashwóŋè gie Cʉ̀apʉ̀a ka gɔɔn ńtí Senakelib á yɔɔn:,this is the word the Lord has spoken against him:
Ɔ̀ kɔ̌ɔn páʼa ńzoonte wɔ̌?,Who is it you have mocked   and blasphemed?
"Ɔ̀ ka tsẅi ngie memántúm pú zoonte wɔ́ɔn,",You have mocked the Lord through your servants.
"N ka túŋ ntse,",I dug wells and drank water in foreign lands.  
"Senakelib, ɔ̀ te ne ńzsé ngie",Have you not heard?  
Ngwɔ́ pʉ̀a pie é tsẅé wó le gÿo tsɔ́ mmó wɔ́.,"Their inhabitants have become powerless,"
"M bǔ ne ńzsé gú ntsèm,","But I know your sitting down,"
"Oon, ɔ̀ ka gẅiin nkwaŋá tepòŋ ńtí wɔ́ɔn.",Because your raging against me
"Ezekiyásè, aliŋé gie n nǎ né gù ayɔɔn: pi ge pfɛ́ɛ sàʼa ngesáŋ ntsíŋ na yɔɔn ngùʼ; é tó fʉ̀ʼ páʼɔɔn, à gíŋe ńgwɔ́ pɔ́ púʼu. Táʼ, é láʼa yetsɔ̌ ngùʼ, é pye ngesáŋ ntsíŋ gi, é gÿo pwɔ́ʼ. É pye metÿǒ melùʼ, é jÿó mentɔ̌ɔn mɛ̌. ","“ ‘This will be the sign for you:   This year you will eat what grows on its own, and in the second year what grows from that. But in the third year sow and reap, plant vineyards and eat their fruit. "
"Epʉ̀a ngwòŋ Yúndà pie é la tsɔgɔ, ge cʉ́ʼ gwɔ́ pɔ́ páʼ múɔ métÿǒ. Pɔ́ ge tswaŋ menŋaŋ, mbwó mɔ́b zém mentɔ̌ɔn. ",The surviving remnant of the house of Judah will again take root   downward and bear fruit upward. 
"Oon, epʉ̀a pie é nyé wó, é ge gÿo fó Yelúzálèm kẅɛ. Epie é ka tsɔgɔ, e kwɔ́ʼ ńtyé ndùm lekwɛ́ Siyoŋ.","For a remnant   will go out from Jerusalem, and survivors from Mount Zion. The zeal of the Lord of Armies will accomplish this.’  # 37:32 2Kg 19:31; Is 9:7; 59:17; Jl 2:18; Zch 1:14"
"Esǎyà gíŋe ńgɔɔn ngie: «Afʉ̀ʼɔɔn la, anò gie Cʉ̀apʉ̀a gɔ̌ɔn ńtí fùɔ Asili ayɔɔn: Ngwɔ́ á le gÿo kúu tsɛ̀ɛ tÿǒsoŋ yɔɔn wɔ́. Ngwɔ́ á le maʼ mbɔɔ tàʼ lekwoŋ kyɛ́d wó wɔ́. Ngwɔ́ á le lÿɔ́ʼɔ tÿósoŋ yɔɔn wɔ́. Ngwɔ́ á le lyeen nzèm mekʉ́ʼʉ ncù mé, ńkwéʼe mezyɛ̀ʼɛ mie à ge fó mǒ, é lɔg tága tÿǒsoŋ yɔɔn lé ncù wɔ́. ","“Therefore, this is what the Lord says about the king of Assyria:"
"À ge tÿɔ́gɔ kwò yé na yetsɔ́, ngwɔ́ à le tÿǒsoŋo Yelúzálèm kú! Mèŋ Cʉ̀apʉ̀a zɔ gɔ̌ɔn. ",He will go back
"N ge pɔ́ɔnte yɔɔn tÿǒsoŋ, é gÿo à tsẅɛ́. N ge gÿo púʼu, ńtí nue n gee Ssé; ḿbiŋ ńgẅiin pyennɛ́ nzèm fùɔ Ndavîd gẅie aa ngàŋafàʼ wɔ̀ɔn.»",I will defend this city and rescue it
" Cÿɔ́ʼ Cʉ̀apʉ̀a ka kúu jʉʼʉ mentàb pʉ̀a Asili; ńgÿo mbàŋa ntsáʼ ntsɔ̀b tʉ̂a lé móm lefɔ̌ɔn nzèm nkÿo, é kwéte. Njÿó lʉ́a, palÿɔ́ʼncù pú ńgyá pʉ̀a pie é kweté. ","Then   the angel of the Lord   # 37:36 Gn 16:7–11; Ex 3:2; Nm 22:22–35; Jdg 6:11–12; 2Sm 24:16; Ps 34:7 went out and struck down one hundred eighty-five thousand in the camp of the Assyrians. When the people got up the next morning, there were all the dead bodies! "
"Á cʉa púʼu, Senakelib gẅie aa fùɔ Asili gÿo mé tsɔ́ʼte mentàb. Ḿbiŋ nzèm né tÿǒsoŋo Ninive, ńcʉ́ʼʉ ńtsẅé pɔ́ wó. ",So King Sennacherib of Assyria broke camp and left. He returned home and lived in Nineveh.  
"Á táa ńgwɔ́ tsɔ́ lyɛ̌ʼ, Senakelib gwɔ́ ndá ssé yé, lezíŋ ssé ŋwɛ́ gwɔ́ lê Niselɔg, ńne sẅíŋte yé, Andalaméleg pɔ́ Salese pie ée penkʉ́ pé pembàŋa lɔg nně ncù ńzẅé yé, ńkÿo ńgʉa né ngwòŋ Alalad; Asalandoŋ gẅie à gíŋe ńgwɔ́ tsɔ̌ míŋ we wembàŋa, á jÿó ndá ye, ńcʉ́ʼʉ fùɔ.","One day, while he was worshiping in the temple of his god Nisroch, his sons Adrammelech and Sharezer struck him down with the sword and escaped to the land of Ararat.   Then his son Esar-haddon  # 37:38 Ezr 4:2 became king in his place."
