ngiemboon,en
"Njÿó la gwaa zyete, ashwóŋè gwɔ́ pɔ́ wó, yé shwóŋè pɔ́ Ssé laa wó. Á piŋ ńgwɔ́ pɔ́ Ssé. ","In the beginning   was the Word,  # 1:1 Jn 1:14; 1Jn 1:1; Rv 19:13 and the Word was with God, and the Word was God.  # 1:1 Jn 20:28; Php 2:6 "
Yé shwóŋè pɔ́ Ssé gwɔ́ tà fó pɔ́ nzyeté. ,He was with God in the beginning.   
"Akɔ̀ɔkɔ́ɔ gwaa gwɔ́ wó, ńcʉa pɔ́ na yé. Atsɔ́ mmó té gwɔ́ wó té gwɔ́ gie á cʉ̌a pɔ́ na yé wɔ́. ","All things were created   through him,  # 1:3 Rm 11:36 and apart from him not one thing was created that has been created. "
"Legwɔ́ wó à laa na yé, legwɔ́ ŋwɛ́ á gwɔ́ kyɛ̀ʼ gie á kyɛʼɛ pʉ̀a mesoŋ. ","In him was life,  ,# 1:4 1Jn 2:5 and that life was the light  # 1:4 Ps 36:9; Jn 12:46 of men. "
"Akyɛ̀ʼ ne ńkyɛʼɛ nzěm, nzěm ké te kúbe.","That light shines   in the darkness, and yet the darkness did not overcome  # 1:5 Or grasp, or comprehend, or overtake; Jn 12:35 it.  # 1:5 Php 3:12"
"E Ssé gÿo ńtúmo tsɔ̌ nyìŋ, lezíŋ se gwɔ́ lê Jÿâŋ. ",There was a man sent from God whose name was John.   
"Á tó ńgwɔ́ jÿòngyá, á léshwóŋo mmó gie à zsě ńtí kyɛ̀ʼ ŋwɛ́, légwɔ́ gie wɔ̌wɔ́ɔ ge záb ntʉ́m wé na kyɛ̀ʼ ŋwɛ́. ","He came as a witness to testify about the light, so that all might believe through him.   "
"À la te kyɛ̀ʼ wɔ́, à la tó yé pɔ́ léshwóŋ pʉ̀a nò na kyɛ̀ʼ. ","He was not the light, but he came to testify   about the light. "
Yé shwóŋè ŋwɛ́ laa kwàʼ kyɛ̀ʼ gie á tǒo tsɛ̀ɛ njÿó lékyɛʼɛ mânyìŋ ntsèm.,"The true light   that gives light to everyone was coming into the world.  # 1:9 Or The true light who comes into the world gives light to everyone, or The true light enlightens everyone coming into the world.,# 1:9 Jn 18:37; 1Jn 2:8"
"Yé shwóŋè laa tsɛ̀ɛ njÿó, tá pʉ̀a mesoŋ ké te yé zsé. Mbà pɔ́ la ké ńcʉa pɔ́ na yé tá ńgwɔ́ wó. ","He was in the world, and the world was created   through him, and yet the world did not recognize him. "
"À la tóo kwàʼ láʼ pɔ́b, epʉ̀a láʼ pé té yé kúe. ","He came to his own, and his own people did not receive him. "
"Táʼ, etsɔ́ pʉ̀a kúe yé, ńzáb ntʉ́m na yé, á leen ńké ńnáa wɔ́b tʉ̀ lécʉ́ʼ púɔ Ssé. ","But to all who did receive   him,  # 1:12 Jn 5:43 he gave them the right  # 1:12 Mk 1:22; Ac 9:14 to be  # 1:12 Or become children  # 1:12 Lk 1:7 of God,  # 1:12 Mt 5:9; Jn 11:52; Rm 8:16; 1Jn 3:1 to those who believe  # 1:12 Jn 3:16 in his name,  # 1:12 Jn 10:25; 1Jn 3:23 "
"Legwɔ̌ púʼu, à těen fóo na ntí gie mámbàŋa pɔ́ manzwě kwǒŋ ńzyé wɔ́, ńké těen fóo na lekwoŋ we nyìŋ mesoŋ wɔ́, mé gɔɔn légwɔ́ púɔ Ssé, mbà Ssé zɔ kwǒŋ yɛ̌ ntí lezyé.","who were born,   not of natural descent,  # 1:13 Lit blood or of the will  # 1:13 1Co 7:37; 16:12; Eph 2:3; 2Tm 2:26; 2Pt 1:21 of the flesh,  # 1:13 Php 3:3 or of the will of man,  # 1:13 Or not of human lineage, or of human capacity, or of human volition but of God.  # 1:13 1Pt 1:3; 1Jn 2:29"
"Ashwóŋè la cʉ́ʼʉ nyìŋ mesoŋ, ńtó ńtsẅé tsetsɛ̀ɛ pege, pege gyá legúʼ we, á gwɔ́ legúʼ Múɔ wémɔʼɔ́ gẅie à fóo lejʉ́ŋ Tá, ḿbú ńgẅiin pòŋontʉ́m, ńnyɛ pɔ́ nò nénʉ́.","The Word   became flesh  # 1:14 Php 2:7; 1Jn 4:2; 5:20 and dwelt  # 1:14 Or and dwelt in a tent; lit and tabernacled among us. We observed his glory,  # 1:14 Mk 10:37; Jn 17:24 the glory as the one and only  # 1:14 Heb 11:17; 1Jn 4:9 Son  # 1:14 Son is implied from the reference to the Father and from Gk usage. from the Father, full of grace and truth. "
"Jÿâŋ gÿo ńgɔɔn mmó gie à zsé na nyìŋ ŋwɛ́, ńdɔg ngyè tetʉ̂ ngie: «Wɛ̂ áa nyìŋ gẅie n kɔ̌ɔn shwóŋo gẅi la, páʼ n kɔ̌ɔn ńgɔɔn ngie: “Nyìŋ aa nzèm mèŋ ńne ńtóo, à cʉa wɔ́ɔn, mélàʼmie mé la gwaa zyé wɔ́ɔn, á gwɔ́ pɔ́ wó.”» ","(John testified concerning him and exclaimed, “This was the one of whom I said, ‘The one coming after me   ranks ahead of me,  # 1:15 Col 1:19 because he existed before me.’ ”)  # 1:15 Jn 3:13; 8:58; 10:30; 14:7–9,23; Php 2:6 "
"Angàŋ kéen ńtó, à lɔg páʼ à gẅiin pòŋontʉ́m, ńcÿó gʉm yégè metsèm tɛʼ, ńcÿó sele ńcÿó, mélàʼmie à gẅiin nkwòŋe tɛʼ. ","Indeed, we have all received grace   upon  # 1:16 Or in place of grace from his fullness, "
"E Ssé la cʉa na Mǒonsê, ńná lepʉ̌, anò nénʉ́ pɔ́ nò lécÿó gʉm yégè piŋ ńcʉa pɔ́ na Yěsô Keleto. ",for the law was given through Moses;   grace and truth  # 1:17 Ps 119:142; Jn 14:6; 2Th 2:10 came through Jesus Christ. 
"Atsɔ̌ nyìŋ laa Ssé gyá, tà ńdí ndàʼ Múɔ wémɔʼɔ́ gẅie aa Ssé ńgwɔ́ lejʉ́ŋ Tá, à la gÿo mé zsé yé.","No one has ever seen God. The one and only   Son, who is himself God and is at the Father’s  # 1:18 Mt 5:16; 11:27; Jn 8:42 side  # 1:18 Other mss read The one and only Son, who is at the Father’s side  #— #he has revealed him.  # 1:18 Mt 11:27; Lk 10:22; 1Jn 2:24"
"Jÿâŋ gÿo ńgɔɔn nò ńtí Yěsô. Á gwɔ́ tsɔ́ fʉ̀ʼ, pasáʼa láʼ pà Yúndà pie ée Yelúzálèm túm panuŋepwɔʼ pâ pʉ̀a Lěvî, ngie pɔ́ gʉa ńzɛ́te Jÿâŋ ngie: «À gwɔ́ pɔ́ wɔ̌?» ","This was John’s testimony when the Jews from Jerusalem   sent priests  # 1:19 Ac 4:1 and Levites  # 1:19 Ex 6:19; Lk 10:32 to ask him, “Who are you? ”"
Jÿâŋ shʉashʉa ńgɔɔn mbwó mânyìŋ ntsèm té mʉ́ʼte ngie: «N te Nzàʼnkÿo gẅie Ssé la kaʼ wɔ́.» ,"He didn’t deny it but confessed, “I am not the Messiah.”  "
Pɔ́ zɛ́te yé ngie: «Tà ɔ̀ gwɔ́ pɔ́ wɔ̌? Ɔ̀ gwɔ́ pɔ́ Elîɛ keen?» Jÿâŋ gɔɔn ngie: «Ngǎŋ.» Pɔ́ zɛ́te ngie: «Ɔ̀ gwɔ́ pɔ́ ntsẅìnkʉ̀ Ssé gẅie mé ne ńzẅíʼte la keen?» Jÿâŋ gɔɔn ngie: «Ngǎŋ.»,“What then? ” they asked him. “Are you Elijah? ”  
"Pɔ́ leen ńké ńgɔɔn né yé ngie: «Shwóŋo wég nyìŋ gẅie ɔɔ yé, ńzsé ngie peg ge gẅiin nò gie peg ge tó shwóŋ pʉ̀a pie é ně ńtúmo wég. Kwàʼ gù lé twó ɔ́, ɔ̀ kwǎŋ ngie ɔɔ wɔ̌?» ","“Who are you, then? ” they asked. “We need to give an answer to those who sent us. What can you tell us about yourself? ”"
"Jÿâŋ lɔgɔ shwóŋè gie ntsẅìnkʉ̀ Ssé Esáyà la gɔɔn ńtsɔ́ʼ ngie: «N gee nyìŋ gẅie aa kwòŋotsẅɛ, ésáʼa ńgɔɔn ngie: “Pi siŋte mánzsè Cʉ̀apʉ̀a à tyé ndʉŋndʉŋ.”» ","He said, “I am a voice of one crying out in the wilderness: Make straight the way of the Lord   ,# 1:23 Is 40:3  #— #just as Isaiah  # 1:23 Mt 3:3; 4:14; 12:17 the prophet said.”"
"Epʉ̀a pie mé la túmo wɔ́b mbwó Jÿâŋ, é laa pafalísáyè. ",Now they had been sent from the Pharisees.   
"Pɔ́ gíŋ ńzɛ́te Jÿâŋ ngie: «Ɔ̀ te Nzàʼnkÿo wɔ́, ńké te Elîɛ wɔ́, ńké te ntsẅìnkʉ̀ Ssé gẅie mé ne ńzẅíʼte wɔ́, tà mélàʼakɔ́ ɔ̀ nuʼu pʉ̀a ntse?» ","So they asked him, “Why then do you baptize if you aren’t the Messiah, or Elijah, or the Prophet? ”"
"Jÿâŋ tsɔ́ʼɔ mbwó pɔ́b ngie: «À gʉa na mèŋ, mbà n nuʼu pʉ̀a pɔ́ ndàʼ tsɛ̀ɛ ntse. Atsɔ̌ nyìŋ ké ńgwɔ́ tsetsɛ̀ɛ pi, pi nyé té zsé yé, ","“I baptize with   water,”  # 1:26 Mk 1:8 John answered them. “Someone stands among you, but you don’t know him. "
"ayé nò ge pɔ́ɔnte yɔ́ɔn, mèŋ fǒ te kúʼu léŋwéʼe ssé ńkyɛ́ʼ nkÿo melɔ̌ɔn mé wɔ́.» ","He is the one coming after me,  ,# 1:27 Jn 1:15 whose sandal strap I’m not worthy to untie.” "
"Mé lɔ́ɔn ńzɛ́te yé mɔɔn menò páʼɔɔn á Mbetani, á na yetsɔ̌ nzǐŋ ntse Juundʉŋ á jʉʼ gie à lɔ̌ɔn ńnuʼu pʉ̀a ntse wó.","All this happened in Bethany   across the Jordan,  # 1:28 Mk 10:1; Lk 3:3 where John was baptizing."
"Njÿó gÿo ńdʉ́a, Jÿâŋ gyá Yěsô ne ńtóo, á gɔɔn ngie: «Wɔɔn aa Múɔ Njʉ̀njÿò gẅie Ssé lɔgɔ sẅɛʼɛ ndòon menò mie pʉ̀a la gÿo. ","The next day John saw Jesus coming toward him and said, “Look, the Lamb of God,   who takes away the sin  # 1:29 Jn 15:22; 1Jn 3:5 of the world! "
"Aa yé gẅie n kɔ̌ɔn shwóŋo gẅi la, páʼ n kɔ̌ɔn ńgɔɔn ngie: “Nyìŋ aa nzèm mèŋ ńne ńtóo, à cʉa wɔ́ɔn, mélàʼmie mé la gwaa zyé wɔ́ɔn, á gwɔ́ pɔ́ wó.” ","This is the one I told you about: ‘After me comes a man who ranks ahead of me, because he existed before me.’ "
"Kwàʼ mèŋ n da te ne ńzsé nyìŋ gẅie à ge gÿo gwɔ́ wɛ̌ wɔ́. Tá n ka tǒ yɔ́ɔn, ńne ńnuʼu pʉ̀a ntse lélɔg ńgÿo pà Ésàlayɛ zsé yé.»","I didn’t know him,   but I came baptizing with water so that he might be revealed  # 1:31 2Co 4:11; 1Jn 1:2 to Israel.” "
"Jÿâŋ gɔɔn tsɔ́ nò gie à zsé na Yěsô, ngie: «N da gyá Zẅìge Ssé sẅɛ́ʼ ńnéŋe na yé, ńgwɔ́ páʼ kàpʉ̀ŋ la. ","And John testified, “I saw the Spirit   descending from heaven like a dove, and he rested on him.  # 1:32 Jms 4:5 "
"Kwàʼ mèŋ n da zɔɔn te ne ńzsé yé wɔ́, tá Ssé gẅie à la túmo wɔ́ɔn ngie n gʉa ńnuʼ pʉ̀a ntse, yé zɔ̌ gɔɔn né mèŋ ngie: “Ɔ̀ ge gÿo gyá, à Zẅìge Ssé tó ńnéŋe na nyìŋ. À gwɔ́ yé gẅie à ge néŋ pʉ̀a mbwó Zẅìge Ndʉalʉ̌a.” ","I didn’t know him, but he who sent me to baptize with water told me, ‘The one you see the Spirit descending and resting on #— #he is the one who baptizes with the Holy Spirit.’   "
"N da gyá, tà n ne sáʼa éshwóŋo pʉ̀a ngie aa Míŋ Ssé.»","I have seen and testified that this is the Son of God.”  ,# 1:34 Mt 3:17; 4:3; Jn 1:49; 5:19; Heb 1:2"
"Njÿó gÿo ńdʉ́a, Jÿâŋ pâ tsɔ́ megàŋakwò pé pépʉ́a nyé ńgwɔ́ pɔ́ jʉʼ gie à kaa wó. ","The next day, John was standing with two of his disciples. "
"Á maʼ lejÿɔ́g, ńgyá Yěsô páʼ à ne ńcʉa, ńgɔɔn ngie: «Wɔɔn aa Múɔ Njʉ̀njÿò Ssé.» ","When he saw Jesus passing by, he said, “Look, the Lamb of God! ”"
"Megàŋakwò Jÿâŋ ya yépʉ́a júʼu yɔɔn shwóŋè, ńcʉ́me nzèm Yěsô. ",The two disciples heard him say this and followed Jesus. 
"Yěsô sele nnɛ́, ńgyá páʼ pɔ́ ée nzèm yé, ńzɛ́te wɔ́b ngie: «Pi faʼa kɔ́?» Pɔ́ tsɔ́ʼɔ mbwó yé ngie: «Labi (ńdɔgɔ ńgɔɔn ngie: “Tsítsà”), ɔ̀ tsẅé nzɔ̌?» ","When Jesus turned and noticed them following him, he asked them, “What are you looking for? ”"
"Yěsô gɔɔn ngie: «Pi tó, pi ge gyá.» Pɔ́ leen ńké ńgʉa ńgyá jʉʼ gie à tsẅé wó. Á gwɔ́ na nèm tá mbÿɛ̀njÿó, pâ pɔ́ néŋe tà yɛ̌ lyɛʼɛ́ láʼ mag."," “Come and you’ll see,” he replied. So they went and saw where he was staying, and they stayed with him that day. It was about four in the afternoon.  "
"Á la gʉa na pʉ̀a mépʉ́a pie é la júʼu shwóŋè Jÿâŋ, ńcʉ́me nzèm Yěsô la, lezíŋ tsɔ̌ tàʼ nyìŋ laa lê Ndeléyà, á gwɔ́ fɛ̌ Símò Piɛ. ","Andrew,   Simon Peter’s brother, was one of the two who heard John and followed him. "
"Ndeléyà ŋwɛ́ gʉa ńnyé té shwóŋo tsɔ̌ nyìŋ, ḿvɔg ńgyá fɛ̌ we Símò, ńgɔɔn né yé ngie: «Peg gyǎ Nzàʼnkÿo.» Pɔ́ tóŋo yé lê «Nzàʼnkÿo» páʼɔɔn, á lɔgɔ ńgíŋe ńgɔɔn ngie: «Keleto.» ","He first found his own brother Simon and told him, “We have found the Messiah”  ,# 1:41 Mt 1:17 (which is translated “the Christ”),  # 1:41 Ex 29:29 "
"Ńdɔgɔ Símò, ńgʉa lejʉ́ŋ Yěsô, Yěsô cwoŋo ńdíe Símò tà ńgɔɔn né yé ngie: «Ɔɔ Símò míŋ Jÿâŋ. Mé ge gÿo tóŋo gú lê Sefásè.» Yěsô tóŋo yé lê «Sefásè» páʼɔɔn, á lɔgɔ ńgíŋe ńgɔɔn ngie: «Piɛ.»",and he brought Simon to Jesus.
"Njÿó gÿo ńdʉ́a, Yěsô záb ngie à ge gʉa tsɛ̀ɛ pàga ngwòŋ Ngalílîa, ńne ńgee, ḿbumte Filib, ńgɔɔn né yé ngie: «Cʉ́me nzèm mèŋ, pɔ̀gɔ zɔ cʉ́ʼʉ ńgiŋe!» ","The next day Jesus   decided to leave for Galilee. He found Philip  # 1:43 Mk 3:18 and told him, “Follow me.”"
"Filib ŋwɛ́ laa nyìŋ Mbɛtsayinda, á tÿǒsoŋo pà Ndeléyà pâ pà Piɛ. ","Now Philip was from Bethsaida,   the hometown of Andrew and Peter. "
"Filib gʉa ńgyá Natanayɛ, ńgɔɔn né yé ngie: «Peg gyǎ nyìŋ gẅie mé la ŋweʼe nò na yé, á tsɛ̀ɛ ŋwàʼne lepʉ̌ Mǒonsê, mbɔɔ tsɛ̀ɛ meŋwàʼne pà ntsẅìnkʉ̀ Ssé. Peg gyǎ yé, á gwɔ́ Yěsô, míŋ Yesyɛ̂b, á nyìŋ Nǎzalɛd.» ","Philip found Nathanael   and told him, “We have found the one Moses wrote about in the law (and so did the prophets  # 1:45 Mt 2:23; Ac 7:52; Rm 3:21): Jesus the son of Joseph,  # 1:45 Mt 1:16; Lk 1:27; 2:4,16,33; 3:23; Jn 6:42 from Nazareth.”  # 1:45 Mk 1:9"
"Natanayɛ gɔɔn né yé ngie: «Tà mé lǎ zɔɔn ńgyá mmó mbòŋo fó Nǎzalɛd?» Filib tsɔ́ʼɔ mbwó yé ngie: «Tóo, ɔ̀ ge gyá!» ",“Can anything good   come out of Nazareth? ” Nathanael asked him.
"Yěsô gyá páʼ Natanayɛ ne ńtóo, ńgɔɔn nò na yé ngie: «Wɔɔn aa kwàʼ múɔ Ésàlayɛ gẅie anò nkÿonkÿo té na yé wɔ́.» ","Then Jesus saw Nathanael coming toward him and said about him, “Here truly is an Israelite    in whom there is no deceit.”"
Natanayɛ zɛ́te Yěsô ngie: «Ɔ̀ zsé wɔ́ɔn nzɔ̌?» Yěsô tsɔ́ʼɔ mbwó yé ngie: «Filib ně ńgwaa tóŋo gú páʼa n ne ńgyá gú gyǎ. Ɔ̀ kɔʼɔ́ ńnéŋe letsiŋé tÿǒ pÿɛ̀.» ,“How do you know me? ” Nathanael asked.
"Natanayɛ tsɔ́ʼ ngie: «Labi, ɔɔ Míŋ Ssé, ɔɔ fùɔ pa Ésàlayɛ.» ","“Rabbi,”   Nathanael replied, “You are the Son  # 1:49 Jn 5:19 of God; you are the King of Israel! ”  # 1:49 Mt 27:42; Mk 15:32; Jn 12:13"
"Yěsô tsɔ́ʼɔ mbwó yé ngie: «Ɔ̀ zẅǐŋ fʉ̀ʼɔɔn, mélàʼmie n gɔ̌ɔn ngie n ně ńgyá páʼ ɔ̀ néŋe letsiŋé tÿǒ pÿɛ̀. Ɔ̀ ge gíŋ gyá menò mie é fáŋ ńtɔ́g mɛ̌!» ","Jesus responded to him, “Do you believe because I told you I saw you under the fig tree? You will see greater things than this.” "
"Yěsô gíŋ ńkẅiʼi ńgɔɔn ngie: «Tà mèŋ shwóŋo gẅí, kwàʼ nénʉ́, pi ge gÿo gyá, encwò tÿǒ lepwó tsɔ́ʼɔ ńtyé, mecÿɔ́ʼ Ssé, é ne fóo wó, é sẅɛ́ʼɛ na Míŋ Nyìŋ, ḿbiŋe ńkwɔ́ʼɔ.»","Then he said, “Truly I tell you, you will see heaven opened and the angels of God    ascending and descending   # 1:51 Gn 28:12 on the Son of Man.”   # 1:51 Mk 2:10"
