ngiemboon,en
"Engẅɛ̀te Manase gẅie à laa múɔ letwó Yesyɛ̂b, e la gíŋe ńgẅiin yé tàʼa pàga láʼ. Makîi gẅie aa múɔ letwó Manase, ńgwɔ́ tá pà Ngalad, la gẅiin pàga láʼa Ngalad pɔ́ Mbashÿaŋ, ńtí nue à laa ndÿɔ̀ʼncù. ","This was the allotment for the tribe of Manasseh   as Joseph’s firstborn. Gilead and Bashan were given to Machir, the firstborn of Manasseh and the father of Gilead, because he was a man of war.  # 17:1 1Ch 28:3 "
"Mé la gíŋe ńná mepàga láʼ me petsɔ́ pʉ̀a na menkenkÿo tsìŋendá Manase. Mé la náa ye penkʉ́ Ambiyezɛ̂ɛ ńnáa ye penkʉ́ Elɛg, ńnáa ye penkʉ́ Aseliyɛɛ, ńnáa ye penkʉ́ Sishÿɛ̂m, ńnáa ye penkʉ́ Efɛ̂ɛ, ńnáa ye penkʉ́ Shÿeminda, ńgwaa ná ḿmaʼa tyèente tá ńdɔg ńná. Yɔɔn lɔgɔ páʼɔɔn ḿbú ńgwɔ́ gubé Manase yembàŋa, á na menkenkÿo metsìŋendá; Manase lɔgɔ púʼu ńgwɔ́ míŋ Yesyɛ̂b wembàŋa.","So the allotment was for the rest of Manasseh’s descendants by their clans, for the sons of Abiezer, Helek, Asriel, Shechem, Hepher, and Shemida. These are the male descendants of Manasseh son of Joseph, by their clans."
"Zelofad laa míŋ Efɛ̂ɛ, ńgwɔ́ míŋ míŋ Ngalad; Yé Ngalad gwɔ́ míŋ Makîi, ńgwɔ́ míŋ míŋ Manase. Zelofad ŋwɛ́ la te gẅiin púɔ mbàŋa wɔ́; à la gẅiin pɔ́ púɔ panzwě; mezíŋ mɔ́b mɔɔn: wɔɔn laa, Mala, wɔɔn gwɔ́ Nowa, wɔɔn gwɔ́ Ogela, wɔɔn gwɔ́ Mileka ńgÿo Tiitsa. ","Now Zelophehad son of Hepher, son of Gilead, son of Machir, son of Manasseh, had no sons, only daughters. These are the names of his daughters: Mahlah, Noah, Hoglah, Milcah, and Tirzah.   "
"Epúɔ panzwě ŋwɛ́ la gʉa ńgyá Eleyazaa gẅie aa nùŋepwɔʼ, lâ Yǒonshûa míŋ Nûn, ńgÿo melÿò tsɛ̀ɛ láʼ, ńgɔɔn né pɔ́b ngie: «Cʉ̀apʉ̀a la tsẅii mbwó Mǒonsê ngie à gʉa na tsetsáʼa mefɛ̌ pég, ńná wég tÿɔgɔ́.» Ńgɔɔn púʼu, mé leen ńké ńgʉa na tÿɔgɔ́ gubé fɛ̌ tá wɔ́b yembàŋa, ńná wɔ́b tÿɔgɔ́, ndʉŋndʉŋ páʼ Cʉ̀apʉ̀a la gɔɔn. ","They came before the priest Eleazar, Joshua son of Nun, and the leaders, saying, “The Lord commanded Moses to give us an inheritance among our male relatives.” So they gave them an inheritance among their father’s brothers, in keeping with the Lord’s instruction.   "
"Mé lɔ́ɔn ńdɔgɔ páʼɔɔn ńnáa metsetsáʼ pǎb legém, á mbwó ngẅɛ̀te Manase, ńkẅiʼi na metÿǒsoŋ pʉ̀a Ngalad pɔ́ Mbashÿaŋ mie ée na yetsɔ̌ nzǐŋ ntse Juundʉŋ. Ńcʉ́ʼʉ léná, ḿmaʼa tyèente tá ńdɔg ńná. ","As a result, ten tracts fell to Manasseh, besides the land of Gilead and Bashan, which are beyond the Jordan,   "
"Á gwɔ́ púʼu, egubé Manase yepanzwě lɔgɔ ńgẅiin wɔ́b tÿɔgɔ́, á na tÿɔgɔ́ gubé Manase yembàŋa. Apàga láʼa pʉ̀a Ngalad leen ńké ńgwɔ́ ye yetsɔ́ gubé Manase yembàŋa.",because Manasseh’s daughters received an inheritance among his sons. The land of Gilead belonged to the rest of Manasseh’s sons.
"Ndège láʼ Manase la fó Asɛɛ, ńgʉa gʉa ńkúu Migmetad á shÿó sǎʼnèm we Sishÿɛ̂m; ḿbiŋ fó Migmetad ńdɔg ye shÿó ntsíŋ, á lé gee láʼa pʉ̀a Eyiŋ-Tapuwa. ",The border of Manasseh went from Asher to Michmethath near Shechem. It then went southward toward the inhabitants of En-tappuah. 
"Apàga láʼa Tapuwa, á laa láʼa Manase; táʼ, mé náa tÿǒsoŋo Tapuwa gie á laa ndège láʼa Manase, á mbwó ngẅɛ̀te Efalayîm. ","The region of Tappuah belonged to Manasseh, but Tappuah itself on Manasseh’s border   belonged to the descendants of Ephraim. "
"Ndège láʼ ŋwɛ́ piŋ ńcʉa ngʉ̀ŋe métàʼntse Kánà. Ńgʉa na shÿó ntsíŋ, mbà metÿǒsoŋ mie é laa nùɔ metÿǒsoŋo Manase, é la cʉ́ʼ me Efalayîm. Ńgʉa twó kwóŋ métàʼntse, ndège pàga láʼa Manase gʉa gʉa ńkúu nkʉ̀ŋ ntse máŋʉ́ Mendítèlane. ","From there the border descended to the Brook of Kanah; south of the brook, cities belonged to Ephraim among Manasseh’s cities. Manasseh’s border was on the north side of the brook and ended at the Mediterranean Sea. "
"Atsetsáʼ Efalayîm laa shÿó ntsíŋ, Aye Manase gwɔ́ shÿó kwóŋ. Ntse Máŋʉ́ gwɔ́ lepàa sɔ́b. Metsetsáʼ mɔ́b la gʉa tà fúɔte tsetsáʼa Asɛɛ, á shÿó kwóŋ, ḿbiŋ ńgʉa tà fúɔte tsetsáʼa Esakaa á shÿó sǎʼnèm. ","Ephraim’s territory was to the south and Manasseh’s to the north, with the Sea as its border. They reached Asher on the north and Issachar on the east. "
"Mé la gʉa na metsetsáʼa Esakaa pɔ́ me Asɛɛ, ngẅɛ̀te Manase gẅiin Mbɛ́d-Shÿeyaŋ, tà mbɔɔ mejʉʼ mie é tswéʼe mǒ, ńgẅiin Yimbeleyam, tà mbɔɔ mejʉʼ mie é tswéʼe mǒ, ńgẅiin pʉ̀a tÿǒsoŋo Ndɔ̂ɔ, tà mbɔɔ mejʉʼ mie é tswéʼe mǒ, ńgẅiin pʉ̀a tÿǒsoŋo Eyiŋ-Ndɔ̂ɔ, tà mbɔɔ mejʉʼ mie é tswéʼe mǒ, ńgẅiin pʉ̀a tÿǒsoŋo Taanag, tà mbɔɔ mejʉʼ mie é tswéʼe mǒ, ńgẅiin pʉ̀a tÿǒsoŋo Mengindo, tà mbɔɔ menkwɔʼɔ́ méntá mie é tswéʼe mǒ. ","Within Issachar and Asher, Manasseh had Beth-shean, Ibleam, and the inhabitants of Dor with their surrounding villages;   the inhabitants of En-dor, Taanach, and Megiddo #— #the three cities of  # 17:11 LXX, Vg read the third is Naphath #— #with their surrounding villages.  # 17:11 Jos 11:2; 12:23"
Epʉ̀a Manase la te kuʼu létág pʉ̀a pie é tsẅé tsɛ̀ɛ mɔɔn metÿǒsoŋ wɔ́. Epʉ̀a Kánàhan ée ńké ńnyé ńtsẅé tsɛ̀ɛ wɔɔn ngwòŋ tsẅě. ,"The descendants of Manasseh could not possess these cities, because the Canaanites were determined to stay in this land. "
"Epʉ̀a Ésàlayɛ la gwɔ́ tà ńgíŋ ńkẅiʼi ńgáʼ, ńdɔg pʉ̀a Kánàhan ńgÿo menkwɔɔn. Táʼ, ńké te kuʼu létága wɔ́b wɔ́.","However, when the Israelites grew stronger, they imposed forced labor on the Canaanites but did not drive them out completely.  "
"Egubé Yesyɛ̂b yembàŋa zɛ́te Yǒonshûa ngie: «Ńtí kɔ́ ɔ̀ ka cʉ́ʼʉ léná wég tÿɔgɔ́, ńná pɔ́ ndàʼ tàʼ pàga láʼ? Ɔ̀ náa tàʼa pàga láʼ púʼu, tá mbà Cʉ̀apʉ̀a la cÿɔʼɔ wég, ńgÿo peg pú ńgyɔ́ɔn?» ","Joseph’s descendants said to Joshua, “Why did you give us only one tribal allotment as an inheritance? We have many people, because the Lord has been blessing us greatly.”"
"Yǒonshûa tsɔ́ʼɔ mbwó pɔ́b ngie: «Páʼ pi pú ńgyɔ́ɔn, tà ngwɔ́ pi le kuʼu lénéŋe tsɛ̀ɛ pàga láʼa mekwɛ́ Efalayîm wɔ́ la, pi pʉ né tsɛ̀ɛ mbím, ńkɔ́ʼɔ jʉʼ tsɛ̀ɛ ngwòŋ pʉ̀a Pelísè tà mbɔɔ tsɛ̀ɛ ngwòŋ pʉ̀a Lefa, ńnéŋe wó.» ","“If you have so many people,” Joshua replied to them, “go to the forest and clear an area for yourselves there in the land of the Perizzites and the Rephaim, because Ephraim’s hill country is too small for you.”"
"Egubé Yesyɛ̂b yembàŋa gɔɔn ngie: «Apàga láʼa mekwɛ́ áa pɛ́ʼɛ̀ ńkɔ́g, tà ngwɔ́ á le kuʼu na peg wɔ́. Ńzɔɔn ńgwaa gwɔ́, epʉ̀a Kánàhan pie é tsẅé tsɛ̀ɛ fúʼ, e pú ńgẅiin mekélêg ncù, é gwɔ́ mie mé la lɔgɔ tʉ̌ ńnyɛte. Epʉ̀a Kánàhan pie é tsẅé tÿǒsoŋo Mbɛ́d-Shÿeyaŋ, tà mbɔɔ mejʉʼ mie é tswéʼe mǒ, é gíŋe ńgẅiin mɔ́b yɔ́b. Ńgíŋe ńgÿo pʉ̀a Kánàhan pie é tsẅé tsɛ̀ɛ fúʼu Jʉzeleyɛɛ.» ","But the descendants of Joseph said, “The hill country is not enough for us, and all the Canaanites who inhabit the valley area have iron chariots, both at Beth-shean with its surrounding villages and in the Jezreel Valley.”"
"Yǒonshûa gɔɔn né pʉ̀a ngẅɛ̀te Efalayîm pâ pʉ̀a ngẅɛ̀te Manase pie é fóo na tsìŋendá Yesyɛ̂b ngie: «Pi gyɔ́ɔn, ḿbiŋ ńkwaʼ ńtʉ. Púʼu la, pi te gÿo gẅiin pɔ́ ndàʼ tàʼa pàga láʼ wɔ́. ","So Joshua replied to Joseph’s family (that is, Ephraim and Manasseh), “You have many people and great strength. You will not have just one allotment, "
"Mé ge gÿo náa pàga láʼa mekwɛ́ né pi, mbɔɔ páʼ, e gwɔ́ pɔ́ mbím. Pi ge gÿo kɔ́ʼ, é pú jÿó. Epʉ̀a Kánàhan gẅiin metʉ̀, ḿbiŋ ńgẅiin mekélêg ncù mie mé la lɔgɔ tʉ̌ ńnyɛte táʼ, pi ge gÿo pú tága wɔ́b.»","because the hill country will be yours also. It is a forest; clear it and its outlying areas will be yours. You can also drive out the Canaanites, even though they have iron chariots and are strong.”"
