ngiemboon,en
"Etÿɔgɔ́ gẅie mé la náa mbwó pʉ̀a Ésàlayɛ, á tsɛ̀ɛ ngwòŋ Kánàhan é wɔɔn: Eleyazaa nùŋepwɔʼ, Yǒonshûa míŋ Nûn, ńgÿo mefùɔ metsìŋendá mengẅɛ̀te Ésàlayɛ la gabte wɔɔn tÿɔgɔ́, á mbwó pʉ̀a Ésàlayɛ. ","The Israelites received these portions that the priest Eleazar,   Joshua son of Nun, and the family heads of the Israelite tribes gave them in the land of Canaan.  # 14:1 Jos 19:51 "
"Mé la cʉ́ʼʉ légabte tÿɔgɔ́ mbwó mengẅɛ̀te lepfwɔʼɔ́ mie é la nyé te gẅiin wɔ́b tÿɔgɔ́, tà mbɔɔ mbwó yetsɔ́ tsemé ngẅɛ̀te Manase, ḿmaʼa tyèente, tá ńdɔg ńgabte, á gwɔ́ páʼ Cʉ̀apʉ̀a la tsẅii mbwó Mǒonsê púʼu. ","Their inheritance was by lot   as the Lord commanded through Moses for the nine and a half tribes, "
"Á nue á la gwaa gwɔ́, mbà Mǒonsê la vɔg ńnáa tàʼ tÿɔgɔ́ á mbwó mengẅɛ̀te mémbʉ́a tà mbɔɔ mbwó yetsɔ́ gwoŋó ngẅɛ̀te, á na yetsɔ́ nzǐŋ ntse Juundʉŋ, táʼ, ńgʉa na pʉ̀a Lěvî pie é laa nùɔ pɔ́b, à te wɔ́b tÿɔgɔ́ ná. ",because Moses had given the inheritance to the two and a half tribes beyond the Jordan. But he gave no inheritance among them to the Levites. 
"Egubé Yesyɛ̂b la nuŋe mengẅɛ̀te mémbʉ́a: é ngẅɛ̀te Manase pɔ́ ngẅɛ̀te Efalayîm; mé la te náa tÿɔgɔ́ ye pʉ̀a Lěvî á tsɛ̀ɛ ngwòŋ Kánàhan wɔ́, tà ńdíndàʼ metÿǒsoŋ mie ngwɔ́ pɔ́ tsẅé wó, ńgÿo metsetsáʼ mie ée mengʉ̀ŋe wó, ńgwɔ́ mie ngwɔ́ pɔ́ pféle menɔ̀ɔn, ḿbiŋ ńdeʼe shúm sɔ́b wó. ","The descendants of Joseph became two tribes, Manasseh and Ephraim. No portion of the land was given to the Levites except cities to live in, along with pasturelands for their cattle and livestock. "
"Epʉ̀a Ésàlayɛ la gabte ngwòŋ. Ńgabte púʼu, ńdɔgɔ ńgÿo mmó gie Cʉ̀apʉ̀a la tsẅii mbwó Mǒonsê.","So the Israelites did as the Lord commanded Moses,   and they divided the land."
"Á táa ńgwɔ́ tsɔ́ lyɛ̌ʼ, egubé Yúndà gʉa ńgyá Yǒonshûa, á Ngilengaa; Kalɛb míŋ Yefúnè nyìŋ Kenaze gɔɔn né yé ngie: «kwàʼ gù ne ńzsé ngie Cʉ̀apʉ̀a ka tsẅii nò gie á líe wɔ́gɔ̀, á mbwó Mǒonsê ngàŋntúm Ssé, á Kandɛ́shÿè-Mbaneya. ","The descendants of Judah approached Joshua at Gilgal, and Caleb son of Jephunneh the Kenizzite said to him, “You know what the Lord promised Moses the man of God at Kadesh-barnea about you and me.   "
"Mǒonsê ngàŋafàʼ Cʉ̀apʉ̀a la gwaa túmo wɔ́ɔn, légwɔ́ gie e fó Kandɛ́shÿè-Mbaneya, ńgʉa ńnáŋ ngwòŋ Kánàhan, n gẅiin ngùʼ móm lekùɔ; n da fó wó ńkwɔ́ʼ, ńnáa mesáʼa kɔ́ mbwó yé ndʉŋndʉŋ. ","I was forty years old when Moses the Lord’s servant sent me from Kadesh-barnea to scout the land, and I brought back an honest report.   "
"Mefɛ̌ pɔ́ɔn pie peg lâ pɔ̌ la pʉ, é la maʼa kwɔ̀gmetsẅiŋ na láʼ, táʼ, ńgʉa na mèŋ, mbà n da gÿo mmó gie n da gẅiin légÿo mvfò Cʉ̀apʉ̀a, é Ssé yɔ̀ɔn. ","My brothers who went with me caused the people to lose heart, but I followed the Lord my God completely.   "
"Á laa lyɛʼó, Mǒonsê gɔɔn tà ńkʉa ngie: Áa nénʉ́, ngwòŋ gẅie ɔ̀ tÿɔ̌g mekwò mú wó, é ge láʼa cʉ́ʼʉ gwɔ́ pɔ́ gú tÿɔgɔ́, tà mbɔɔ we gubé jú yembàŋa, ńtí páʼ ɔ̀ ka gÿo mmó gie ɔ̀ ka gẅiin légÿo á mvfò Cʉ̀apʉ̀a, é Ssé yɔ̀ɔn. ","On that day Moses swore to me, ‘The land where you have set foot will be an inheritance for you and your descendants forever, because you have followed the Lord my God completely.’  "
"N nyé wó páʼɔɔn ńzẅɛ́ʼɛ Cʉ̀apʉ̀a, á gwɔ́ mmó gie à la gɔɔn, é lɔgɔ páʼɔɔn ńgwɔ́ ngùʼ ntsɔ̀b tʉ̂a né móm lekùɔ páʼ Cʉ̀apʉ̀a la gɔɔn yɔɔn nò, á mbwó Mǒonsê, á fʉ̀ʼ gie pʉ̀a Ésàlayɛ lɔ́ɔn ńgiŋe kwòŋotsẅɛ; mèŋ n gee lyɛ̌ʼɔɔn, ńgẅiin ngùʼ ntsɔ̀b tʉ̂a lé móm lefɔ̌ɔn. ","“As you see, the Lord has kept me alive these forty-five years as he promised,   since the Lord spoke this word to Moses while Israel was journeying in the wilderness. Here I am today, eighty-five years old. "
"Ńnyé ńtʉte pɔ́ páʼ n dɔ̌ɔn ńtʉte fʉ̀ʼ gie Mǒonsê la túmo wɔ́ɔn, n gʉa ńnáŋ jʉʼ; n nyě ńgẅiin metʉ̀ fʉ̀ʼɔɔn, pɔ́ páʼ n da gẅiin fʉʼó lélɔg ńdÿɔ́ʼ ncù, lélɔg ńgʉa nzɔ̌ nzɔ̌, ḿbiŋe ḿbiŋe nzèm. ",I am still as strong today as I was the day Moses sent me out. My strength for battle and for daily tasks   is now as it was then.  # 14:11 Dt 34:7 
"Afʉ̀ʼɔɔn la, ná lekwɛ́ sɔɔn né mèŋ, ndʉŋndʉŋ páʼ Cʉ̀apʉ̀a la gɔɔn lyɛʼó púʼu, á nue ɔ̀ la júʼ lyɛʼó ngie pʉ̀a Anag, é tsẅé wó, á tsɛ̀ɛ memǎa metÿǒsoŋ mie mé la lɔg metʉ̂ankáʼ ńkéle. Cʉ̀apʉ̀a lɔɔn ńgwɔ́ né mèŋ, mbà n ge jwoŋo wɔ́b, é jÿó metsetsáʼ mɔ́b páʼ yé Cʉ̀apʉ̀a la gɔɔn.»","Now give me this hill country the Lord promised me on that day, because you heard then that the Anakim are there,   as well as large fortified cities.  # 14:12 Nm 13:28 Perhaps the Lord will be with me and I will drive them out as the Lord promised.”"
"Yǒonshûa néŋ mbʉ́lè na Kalɛb, míŋ Yefúnè wembàŋa; ńnáa tÿǒsoŋ Embeloŋ á mbwó yé, é gwɔ́ wé tÿɔgɔ́. ",Then Joshua blessed Caleb son of Jephunneh and gave him Hebron as an inheritance.   
"Wɔɔn lɔg ńgwɔ́ páʼ á la cʉate púʼu tá Kalɛb gẅie aa nyìŋ Kenaze, ńgwɔ́ míŋ Yefúnè wembàŋa, á gẅiin tÿǒsoŋ Embeloŋ páʼ tÿɔgɔ́ tà ńkú lyɛ̌ʼɔɔn. Ńtí nue à la gÿo mmó gie á la né ńzɛ́te ngie à gÿo mvfò Cʉ̀apʉ̀a, é Ssé Ésàlayɛ.","Therefore, Hebron still belongs to Caleb son of Jephunneh the Kenizzite as an inheritance today   because he followed the Lord, the God of Israel, completely. "
"Mé lɔ́ɔn ńzɔɔn ńtóŋo tÿǒsoŋo Embeloŋ lê kiliyad-Alemba, Alemba laa nyìŋ ndÿò tsɛ̀ɛ nùɔ pʉ̀a Anag. Mɔɔn menò la tɔ́g, wɔɔn ngwòŋ leen ńké ńnéŋe lé mbʉ́lè té gíŋe ńdÿɔ́ʼ ncù.","Hebron’s name used to be Kiriath-arba; Arba was the greatest man among the Anakim.   After this, the land had rest from war.  # 14:15 Ex 33:14; Dt 3:20; 12:10; 25:19; Jos 1:13,15; 11:23; 21:44; 22:4; 23:1; 2Sm 7:1,11,12; 1Kg 5:4; 8:56; Ps 95:11; Mt 11:28–29; Heb 4:1"
