ngiemboon,en
"Mefùɔ láʼ la tó ńnéŋe Yelúzálèm. Apfwɔ̀ʼɔ pʉ̀a láʼ maʼa tyèente légwɔ́ gie tàʼ nyìŋ na pʉ̀a legém ge gʉa néŋe Yelúzálèm, á tÿǒsoŋo ndʉalʉ̌a. Epʉ̀a lepfwɔʼɔ́ piŋ ńcʉ́ʼ ńnéŋe yɔ́b pɔ́ tsɛ̀ɛ metsɔ́ metÿǒsoŋ. ","Now the leaders of the people stayed in Jerusalem,   and the rest of the people cast lots  # 11:1 Neh 10:34 for one out of ten to come and live in Jerusalem, the holy city,  # 11:1 Neh 11:18; Is 48:2; Rv 11:2; 21:2 while the other nine-tenths remained in their towns.  # 11:1 Ezr 2:70; Neh 7:73 "
Epʉ̀a láʼ la síe pʉ̀a pie é la kwóŋ kwoŋ ńzẅíŋe légʉa ńnéŋe Yelúzálèm.,The people blessed all the men who volunteered   to live in Jerusalem.
"Mefùɔ pàga láʼ Yúndà é la gʉa ńnéŋe Yelúzálèm. Petsɔ́ pʉ̀a Ésàlayɛ, é panuŋepwɔʼ, é pʉ̀a Lěvî, é pafaʼa tsɛ̀ɛ ndá Ssé mbɔɔ gubé pafaʼa mbʉ̀a Salémo, pɔ́ néŋe yɔ́b tsɛ̀ɛ metÿǒsoŋ, wɛ̌ nyìŋ wɔ́ɔ néŋe pɔ́ na jʉʼ gie áa yé. ","These are the heads of the province who stayed in Jerusalem   (but in the villages of Judah each lived on his own property in their towns  # 11:3 Neh 7:73; 11:20  #— #the Israelites, priests, Levites, temple servants, and descendants of Solomon’s servants  # 11:3 Neh 7:39–43,46–60  #— # "
"Etsɔ́ ntáʼ pʉ̀a na ngẅɛ̀te Yúndà mbɔɔ na ngẅɛ̀te Mbɛŋjÿamɛŋ la tó ńnéŋe Yelúzálèm. Á gʉa na ngẅɛ̀te Yúndà: wɔɔn laa Ataya, Ataya ŋwɛ́ gwɔ́ míŋ Oziyásè, Oziyásè gwɔ́ míŋ Sakalîɛ, Sakalîɛ gwɔ́ míŋ Amalia, Amalia gwɔ́ míŋ Shÿefatia, Shÿefatia gwɔ́ míŋ Malalɛɛ, Malalɛɛ gwɔ́ nyìŋ na ngẅɛ̀te Pɛlɛ́sè, ",while some of the descendants of Judah and Benjamin settled in Jerusalem):
"wɔɔn la gíŋ ngwɔ́ Maseya, Maseya ŋwɛ́ gwɔ́ míŋ Mbalug, Mbalug gwɔ́ míŋ Kɔ-Hɔ́sè, Kɔ-Hɔ́sè gwɔ́ míŋ Azaya, Azaya gwɔ́ míŋ Andaya, Andaya gwɔ́ míŋ Yoyalib, Yoyalib gwɔ́ míŋ Sakalîɛ, Sakalîɛ gwɔ́ míŋ shÿéla. ","and Maaseiah son of Baruch, son of Col-hozeh, son of Hazaiah, son of Adaiah, son of Joiarib, son of Zechariah, a descendant of the Shilonite. "
Ngẅɛ̀te Pɛlɛ́sè ntsèm gie pɔ́ la pú ńcúʼte ńgʉa né Yelúzálèm gwɔ́ nkÿo lekùɔ ńzáb ntsɔ̀b lefɔ̌ɔn né móm ntɔgɔ́ pie é zeŋe nnɛ́. ,"The total number of Perez’s descendants, who settled in Jerusalem, was 468 capable men."
"Á gʉa na ngẅɛ̀te Mbɛŋjÿamɛŋ gie e la néŋe Yelúzálèm: Wɔɔn laa Salu. Salu ŋwɛ́ gwɔ́ míŋ Meshulam, Meshulam gwɔ́ míŋ Yoyɛd, Yoyɛd gwɔ́ míŋ Pendaya, Pendaya gwɔ́ míŋ Kolaya, Kolaya gwɔ́ míŋ Maseya, Maseya gwɔ́ míŋ Etiyɛ̂ɛ, Etiyɛ̂ɛ gwɔ́ míŋ Yeshÿaya. ",These were Benjamin’s descendants:
"Mé la fóo ná yé, á gwɔ́ Ngambayi pɔ́ Salayi, pɔ́ pú ńcúʼte yɔ́b ńgwɔ́ nkÿo lepfwɔʼɔ́ né ntsɔ̀b lefɔ̌ɔn né móm mbʉ́a, ńdɔgɔ ńgwɔ́ pʉ̀a Mbɛŋjÿamɛŋ pie é la gʉa ńnéŋe Yelúzálèm. ",and after him Gabbai and Sallai: 928. 
"Juwɛ̂, míŋ Zikili laa nyìŋ gẅie à la tyé twómvfò na kɔ̀ɔkɔ́ɔ gie pɔ́ gÿo. Yúndà míŋ Asɛnuwa gwɔ́ nkẅèpwó fùɔ tÿǒsoŋ. ","Joel son of Zichri was the officer over them, and Judah son of Hassenuah was second in command over the city."
"Mɔɔn ée mezíŋ panuŋepwɔʼ: wɔɔn laa Yendaya, míŋ Yoyalib, wɔɔn gwɔ́ Yakiŋ, ",The priests:
"Wɔɔn gwɔ́ Selaya. Selaya ŋwɛ́ gwɔ́ míŋ Hikiya, Hikiya gwɔ́ míŋ Meshulam, Meshulam gwɔ́ míŋ Sandɔg, Sandɔg gwɔ́ míŋ Melayɔd, Melayɔd gwɔ́ míŋ Ayitub, Ayitub gwɔ́ nyìŋ gẅie à tyé twómvfò na ndá Ssé, ","Seraiah son of Hilkiah, son of Meshullam, son of Zadok, son of Meraioth, son of Ahitub, the chief official of God’s temple, "
"pâ mefɛ̌ pɔ́b tyé na mefàʼ ndá Ssé. Pɔ́ la pú ńcúʼte yɔ́b, ńgwɔ́ nkÿo lefɔ̌ɔn ńzáb ntsɔ̀b pʉ́a né móm mbʉ́a, wɔɔn laa Andaya; Andaya ŋwɛ́ gwɔ́ míŋ Yelowam, Yelowam gwɔ́ míŋ Pelaliya, Pelaliya gwɔ́ míŋ Amesi, Amesi gwɔ́ míŋ Sakalîɛ, Sakalîɛ gwɔ́ míŋ Pashuu, Pashuu gwɔ́ míŋ Malekiya, ","and their relatives who did the work at the temple: 822. Adaiah son of Jeroham, son of Pelaliah, son of Amzi, son of Zechariah, son of Pashhur, son of Malchijah "
"pâ mefɛ̌ pé pie é laa mefùɔ tsìŋendá la pú ńcúʼte ńgwɔ́ nkÿo pʉ́a né ntsɔ̀b pʉ́a né móm lekùɔ. Wɔɔn laa Amashÿesayii míŋ Azalɛɛ, Azalɛɛ gwɔ́ míŋ Azayi, Azayi gwɔ́ míŋ Meshʉlemɔd, Meshʉlemɔd gwɔ́ míŋ Emɛɛ, ","and his relatives, the heads of families: 242. Amashsai son of Azarel, son of Ahzai, son of Meshillemoth, son of Immer, "
"pâ mefɛ̌ pɔ́b pazeŋe nnɛ́ na ncù pú ńcúʼte, ńgwɔ́ nkÿo né ntsɔ̀b lefɔ̌ɔn né móm mbʉ́a. Zɔbendiɛle míŋ Ngendolim zɔ lɔ̌ɔn sáʼa wɔ́b.","and their relatives, capable men: 128. Zabdiel son of Haggedolim, was their chief."
"E pʉ̀a Lěvî: Wɔɔn laa Shÿemaya, Shÿemaya ŋwɛ́ gwɔ́ míŋ Ashub, Ashub gwɔ́ míŋ Azilikam, Azilikam gwɔ́ míŋ Ashÿambiya, Ashÿambiya gwɔ́ míŋ Mbuni, ",The Levites:
"Shÿatayii pɔ́ Yozambad, laa tsetsɛ̀ɛ mefùɔ pie ée na ngẅɛ̀te Lěvî mbà mé la cʉ́me mefàʼ mie ée nzème pǐ jʉʼʉ ndá Ssé né pɔ́b. ","and Shabbethai and Jozabad, from the heads of the Levites, who supervised the work outside the house of God; "
"Wɔɔn laa Matania. Matania ŋwɛ́ gwɔ́ míŋ Mishÿé, Mishÿé gwɔ́ míŋ Zabendi, Zabendi gwɔ́ míŋ Asáfè, Asáfè lɔ̌ɔn ńgwaa mezɔ̀bɔ ntse lélɔg ńguʼte Ssé fʉ̀ʼ gie mé ne ńgÿo sẅíŋtè. Wɔɔn gwɔ́ Mbagmbukiya, á tsɔ̌ fɛ́ Matania gẅie à lɔ̌ɔn ńkẅéte yé na mefàʼ mé, wɔɔn gwɔ́ Abenda. Abenda ŋwɛ́ gwɔ́ míŋ Shÿamua, Shÿamua gwɔ́ míŋ Ngalaa, Ngalaa gwɔ́ míŋ Yendutuŋ. ","Mattaniah son of Mica, son of Zabdi, son of Asaph, the one   who began the thanksgiving in prayer;  # 11:17 1Ch 6:31,39; 2Ch 5:12 Bakbukiah, second among his relatives; and Abda son of Shammua, son of Galal, son of Jeduthun.  # 11:17 1Ch 16:42 "
Epʉ̀a na ngẅɛ̀ Lěvî pie é la pú ńgwɔ́ tÿǒsoŋ ndʉalʉ̌a: pɔ́ la pú ńgwɔ́ nkÿo pʉ́a ńzáb ntsɔ̀b lekùɔ né móm lefɔ̌ɔn. ,All the Levites in the holy city:   284.
"Ńgʉa na papyɛ́b ncwò nkáʼ, mbà wɔɔn laa Akub, wɔɔn gwɔ́ Talemoŋ, ńgÿo mefɛ̌ pɔ́b nkÿo ńzáb ntsɔ̀b pʉ́a né móm sɔɔnmbʉ́a pie pâ pɔ̌ lɔ́ɔn ḿbú ḿbyɛ́bɛ mencwò nkáʼ. ",The gatekeepers:
"Apfwɔ̀ʼɔ pʉ̀a Ésàlayɛ, panuŋepwɔʼ mbɔɔ pʉ̀a na ngẅɛ̀te Lěvî, mé la pú ńnéŋe wɔ́b tsɛ̀ɛ metÿǒsoŋ pà Yúndà, wɛ̌ nyìŋ wɔ́ɔ néŋe pɔ́ na tsetsáʼa pamángʉanjʉʼ pɔ́b. ","The rest of Israel, the priests, and the Levites were in all the villages of Judah, each on his own inherited property.   "
"Pafaʼa tsɛ̀ɛ ndá Ssé, mé ná sɔ́b leneŋé á Ofɛɛ; Tsiha pɔ́ Ngishÿepa gwɔ́ patyé twómvfò na pafaʼa tsɛ̀ɛ ndá Ssé.",The temple servants lived on Ophel;   Ziha and Gishpa supervised the temple servants.
"Nyìŋ gẅie à lɔ̌ɔn ńdíe mefàʼ pʉ̀a Lěvî, à Yelúzálèm, à laa Uzi, Uzi gwɔ́ míŋ Mbani, Mbani gwɔ́ míŋ Ashÿambiya, Ashÿambiya gwɔ́ míŋ Matania, Matania gwɔ́ míŋ Mishÿé. Uzi ŋwɛ́ laa nyìŋ na ngẅɛ̀ Asáfè, é gwɔ́ ngẅɛ̀ gie e la tyé twómvfò légwaa zɔ̀b ndá Ssé. ","The leader of the Levites in Jerusalem was Uzzi son of Bani, son of Hashabiah, son of Mattaniah, son of Mica, of the descendants of Asaph, who were singers for the service of God’s house. "
"Á nue fùɔ la ná tsɔ́ lepʉ̌ ńtí wɔ́b, ḿbiŋ ńgɔɔn mmó gie pagwaa zɔ̀b ge gÿo na lyɛʼɛ́ láʼ.","There was, in fact, a command of the king regarding them, and an ordinance regulating the singers’   daily tasks. "
"Petahiya, à laa míŋ Meshÿezambɛ, Meshÿezambɛ gwɔ́ míŋ Zela, Zela gwɔ́ míŋ Yúndà. Petahiya laa lejʉ́ŋ fùɔ Pɛ́ɛsè ńgwɔ́ ngàŋntúm láʼa Ésàlayɛ.","Pethahiah son of Meshezabel, of the descendants of Zerah   son of Judah, was the king’s  # 11:24 Neh 2:1; 5:14 agent  # 11:24 Lit was at the king’s hand in every matter concerning the people."
"Etsɔ́ metsìŋendá pà Yúndà la gʉa ńcʉ́ʼʉ ńtsẅé pɔ́ tsɛ̀ɛ meláʼ tà mbɔɔ menkáʼ mie é laa Kiliyad-Alemba, lâ meláʼ mie ée mengʉ̀ŋe wó, ńtsẅé Ndimboŋ mbɔɔ meláʼ mie ée mengʉ̀ŋe wó, mbɔɔ Yekabsɛ̂ɛ lâ meláʼ mie ée mengʉ̀ŋe wó. ",As for the farming settlements with their fields:
"Pɔ́ la gíŋe ńtsẅé Yǒonshûa pɔ́ Molanda mbɔɔ Mbɛ́d-Pelɛ̂d, ","in Jeshua, Moladah,   Beth-pelet,"
"ńtsẅé Atsaa-shuwaa, né Mbɛɛshÿeba lâ meláʼ mie ée mengʉ̀ŋe wó, ","Hazar-shual, and Beer-sheba   and its surrounding villages;"
"ńtsẅé Tsiglag, mbɔɔ Mekona lâ meláʼ mie ée mengʉ̀ŋe wó, ",in Ziklag   and Meconah and its surrounding villages;
"ńtsẅé Eyiŋ-Limoŋ, ńtsẅé Tsoleya, ńtsẅé Yalemud, ","in En-rimmon, Zorah,   Jarmuth,  # 11:29 Jos 10:5 and"
"ńtsẅé Zanuwa, ńtsẅé Andulam lâ meláʼ mie ée mengʉ̀ŋe wó, ńtsẅé Lakíshÿè pâ meláʼ mie ée mengʉ̀ŋe wó, ńtsẅé Azeka lâ meláʼ mie ée mengʉ̀ŋe wó. Pɔ́ la kwɛ́ jʉʼʉ mbumté yɔ́b tà fó Mbɛshÿemba á shÿó ntsíŋ ńgʉa ńkúu fúʼu Eŋnom á shÿó kwóŋ. ",Zanoah   and Adullam with their settlements;
"Metsìŋendá na ngẅɛ̀te Mbɛŋjÿamɛŋ néŋe yɔ́b tà fó Ngemba, ńgʉa ńkúu Migmásè, mbɔɔ Aya né Mɛndɛ lâ tsɔ́ meláʼ mie ée mengʉ̀ŋe wó, ",Benjamin’s descendants:
"ńgíŋe ńnéŋe Anatɔd, ńnéŋe Nɔb, ńnéŋe Anania, ","Anathoth,   Nob,  # 11:32 1Sm 21:1; 22:9 Ananiah,"
"ńnéŋe Atsɔ̂ɔ, ńnéŋe Lama, ńnéŋe Ngitayim, ","Hazor,   Ramah,  # 11:33 Jos 18:25 Gittaim,  # 11:33 2Sm 4:3"
"ńnéŋe Andid, ńnéŋe Tsemboyim, ńnéŋe Nembalad, ","Hadid, Zeboim,   Neballat,"
ńnéŋe Lɔ̂d mbɔɔ Ono mbɔɔ tsɛ̀ɛ fúʼu megàŋlevfò. ,"Lod, and Ono,   in Craftsmen’s Valley."
Etsɔ́ pʉ̀a Lěvî fó láʼa pà Yúndà ńgʉa né pàga láʼ ye ngẅɛ̀te Mbɛŋjÿamɛŋ.,Some of the Judean divisions of Levites were in Benjamin.
