ngiemboon,en
"Mvfò aa lepfɛ́ɛ kème jùmo mbelég, ńnéŋe né sẅétè, ńcʉa mé lénéŋ mbab tá ńdúe ndá, ḿbiŋ ne sele ńdÿɔ́ʼɔ mennɛ́.",Better a dry crust with peace
"Ngàŋafàʼ gẅie à zsé lésáŋa nò mboŋó, à ge gÿo jÿó jʉʼ ye múɔ ndá gẅie à lɔ̌g shʉ́ ńkú metá pé, pâ púɔ ndá ge gÿo gabte tÿɔgɔ́.",A prudent servant will rule over a disgraceful son
"Mé tuɔ tʉ̌ ngɔ̂ɔ lâ tʉ̌ nkáb mmɔ̌g, ńdɔg ńzsé ntí ye yɛ̌ yɛ̌ wɔ́ɔ. Táʼ, Cʉ̀apʉ̀a zɔ̌ tsaʼ ntʉ́m nyìŋ mesoŋ, tá ńdɔg ńzsé páʼ é gwɔ́.","A crucible for silver, and a smelter for gold,  "
Nyìŋ tepòŋ kwoŋo lézẅíʼte meshwóŋè tepòŋ; angàŋa cÿɔ̌nò zẅíʼte meshwóŋè lɔg fʉte nyìŋ.,A wicked person listens to malicious talk;  
"Nyìŋ gẅie à gẅe ngàŋngɔ́ʼ, à lɔgɔ ńzoonte nyìŋ gẅie à la pwóon yé. Cʉ̀apʉ̀a ge gÿo záb ngɔ́ʼ twó nyìŋ gẅie nò gÿo nyìŋ, á gyá ńkág.","The one who mocks the poor insults his Maker,  "
"Epʉ̀a pie ée melÿò gẅiin lekág, ńtí gubé gubé yɔ́b, egubé gẅiin lekág ńtí metá pɔ́b.","Grandchildren are the crown of the elderly,"
"Ngwɔ́ ashwóŋè mekùʼ, á le kẅɛɛ ncwò gʉ̀gʉ̀ wɔ́, á gíŋe ḿbú ḿbÿɔ́gɔ mbwó nyìŋ gẅie à sáʼa pʉ̀a mesoŋ lécÿɔ̌nò.",Eloquent words are not appropriate on a fool’s lips;
"Etsɔ́ pʉ̀a kwaŋ ngie lepuʼú sie pɔ́ náa mbwó nyìŋ, é lyɛ́bte fùʼ ńnéŋe pɔ̀ɔn pɔ́b, tà pɔ́ gÿo kɔ̀ɔkɔ́ɔ wɔ́ɔ, á giŋ giŋ.",A bribe   seems like a magic stone to its owner;
"Ɔ̀ lɔɔn tág nzèm shǔ gù, na nò gie à fʉ̌ʼ, mbà ɔ̀ lɔgɔ ńtsɔ́ɔn nkwòŋe, táʼ, ńké ńnéŋe ńkímte pɔ́ nò tepòŋ yé, mbà nò shǔ gí yé ge mag.","Whoever conceals an offense promotes love,  "
"Mé kaga nyìŋ gẅie aa nzsènò á kúte yé, ńcʉa páʼ mé cúɔ nyìŋ gẅie à gʉegʉe lé tsemé mmó, ngʉ̀a nkÿo.",A rebuke cuts into a perceptive person
"Nyìŋ tepòŋ faʼ yé pɔ́ légÿo nò tepòŋ, mé ge gÿo túmo mántúm gẅie à te tsɔ́ɔn mezìŋe wɔ́, à záb ngɔ́ʼ twó yé.",An evil person desires only rebellion;
"Áa mbòŋ lépumte ngàʼngwé gẅie á ne faʼa púɔ pé, ńcʉa légwe na mbwó gʉ̀gʉ̀ gie à ne ńgÿo menò pʉ̀a.",Better for a person to meet a bear robbed of her cubs  
"Mé lɔɔn ńgÿo nò mbòŋo na nyìŋ, á tsɔ́ʼ pɔ́ yetepòŋ, mbà ngɔ́ʼ těen ńdáʼa ńzága ndá yé wɔ́.","If anyone returns evil for good,  "
"Mé zyete shwóŋte á gwɔ́ pɔ́ páʼ letsɔʼɔ́ tâŋ ntse, á poŋ ngie e gwaa cʉ́ʼ melàʼ, ɔ̀ tsɔ́ʼɔ ńkÿo.",To start a conflict is to release a flood;
"Cʉ̀apʉ̀a pʉa shúm sépʉ́a: letsɔʼɔ́ pwó na nyìŋ gẅie à fʉ̌ʼnò, pɔ́ lezabá nò twó nyìŋ gẅie aa ngàŋa nò nénʉ́.",Acquitting the guilty and condemning the just    —
"Nkáb gie ee mbwó gʉ̀gʉ̀ ge kẅéte yé na kɔ́, lélɔg ńjúu zsénò keen? Ngǎŋ! Á te nò gie á líe yé wɔ́!",Why does a fool have money in his hand
"Ashǔ nyìŋ kwoŋo yé pɔ́ te tsẅé fʉ̀ʼ, mé zyé fɛ̌ nyìŋ páʼ à ge gwɔ́ tsɛ̀ɛ cʉanò, à kẅéte.","A friend loves at all times,  "
"Agʉ̀gʉ̀ zɔ̌ tyé ńzẅíŋ tà ńdaŋa tsetsáʼ, ngie à ge toŋ njǔ nyìŋ.",One without sense enters an agreement  
"Nyìŋ gẅie à kwoŋo shwǒŋ, à faʼ meláʼ, nyìŋ gẅie aa ngàŋa ŋáʼtè á nɔ́ɔnte lépyé.",One who loves to offend loves strife;  
"Nyìŋ gẅie nkwaŋá wé té tyé, à te láʼ gyá lepòŋ wɔ́, nyìŋ gẅie à gẅiin meshwóŋè mémbʉ́a à ge gÿo gwe tsɛ̀ɛ ngʉ̀ngʉ̀.","One with a twisted mind will not succeed,"
"Nyìŋ gẅie à zyé gʉ̀gʉ̀, á neŋé pɔ́ né lemÿɔ̀g, múɔ gẅie à gʉe gʉe, ńgwɔ́ tá we le kág.",A man fathers a fool to his own sorrow;
"Lekág gẅie aa tsɛ̀ɛ ntʉ́m nyìŋ gíŋe ńgwɔ́ páʼ ffo mbòŋo gie á zoŋ mbùm nnɛ́, táʼ, nyìŋ lénéŋe ḿmÿɔg mÿɔg, à gÿo mbùm yé taŋ taŋ.","A joyful heart is good medicine,"
"Epʉ̀a tepòŋ zẅíŋe nò lékwɛ́ɛ pwó pɔ́ nzème nzèm, legwɔ́ gie mé té tsɔ́ʼte ntsaŋ ndʉŋndʉŋ wɔ́.",A wicked person secretly takes a bribe  
Nyìŋ gẅie à gẅiin legye zɔ gíŋe ńnéŋe faʼa légẅiin zsénò; tá nÿɔ́g nyìŋ gẅie à gʉe gʉe néŋe ńzyɛ́ʼ zyɛ́ʼ.,"Wisdom is the focus of the perceptive,"
"Múɔ gẅie à gʉe gʉe, à néŋe tá we tsɛ̀ɛ ngɔ́ʼ, ńnéŋe lemÿɔ̀g ntʉ́m má we.",A foolish son is grief to his father
"Á té póŋo lézáʼ ntsaŋ ńzába mmó gie ngàŋa nò nénʉ́ ge péen wɔ́, kà lézáb ngɔ́ʼ twó pʉ̀a pie é gÿo menò mbòŋo tsɛ̀ɛ nò nénʉ́ wɔ́ɔ.",It is certainly not good to fine an innocent person
"Nyìŋ gẅie à sáŋa nò tá ńgɔɔn, à gẅiin zsénò, nyìŋ gẅie à kúʼte mbùm ye, á gẅiin legye.","The one who has knowledge restrains his words,  "
"Megʉ̀gʉ̀ kúʼte ncwò wɔ́b, ńdɔgɔ ńgwɔ́ páʼ pazsénò, pɔ́ lɔɔn te nò gɔɔn, mbà mé ge kwaŋ ngie pɔ́ gẅiin legye.",Even a fool is considered wise when he keeps silent #—
